"Multi-agent cooperation based on behavior prediction and reinforcement learning","Dongyong Yang; Xuejiang Chen; Jingping Jiang","College of Information Engineering, Zhejiang University of Technology, Hangzhou, China; College of Information Engineering, Zhejiang University of Technology, Hangzhou, China; College of Electrical Engineering, University of Zhejiang, Hangzhou, China","Fifth World Congress on Intelligent Control and Automation (IEEE Cat. No.04EX788)","18 Oct 2004","2004","6","","4869","4872 Vol.6","In multi-agent systems based on reinforcement learning, the evaluation to the behavior of an agent depends on the other agents' behaviors closely. The cooperation performance of multi-agent systems can be improved when each agent takes its action after it predicts the other agents' actions self-consciously. In this paper, several methods for predicting other agents' behaviors were presented, which demand all agents to evaluate the probabilities of actions that other agents may take, and joint-action was introduced to the traditional reinforcement learning. An experiment that three agents cooperate to raise an object was conducted to test the performance of multi-agent systems, and its results show that the cooperation process can be speeded by behavior prediction and joint-action is applied to the traditional reinforcement learning successfully.","","0-7803-8273-0","10.1109/WCICA.2004.1343636","","https://ieeexplore.ieee.org/stamp/stamp.jsp?arnumber=1343636","","Learning;Multiagent systems;Educational institutions;System testing","multi-agent systems;learning (artificial intelligence)","multi-agent systems cooperation;behavior prediction;reinforcement learning;joint-action","","2","2","","IEEE","18 Oct 2004","","","IEEE","IEEE Conferences"
"Research of a heuristic reward function for reinforcement learning algorithms","Yingzi Wei; Mingyang Zhao; Feng Zhang; Yulan Hu","Graduate School of Chinese Academy of Sciences, Beijing, China; Shenyang Institute ofAutomation, Chinese Academy and Sciences, Shenyang, China; Graduate School of Chinese Academy of Sciences, Beijing, China; Graduate School of Chinese Academy of Sciences, Beijing, China","Fifth World Congress on Intelligent Control and Automation (IEEE Cat. No.04EX788)","18 Oct 2004","2004","3","","2676","2680 Vol.3","The reward function is considered as the critical component for its effect of evaluating the action and guiding the reinforcement learning (RL) process. According to the distribution of rewards in the space of states, reward functions can have two basic forms, dense and sparse. We present an idea of designing a heuristic reward function in this paper. An additional reward is added to the traditional sparse reward function. The additional reward function F is a difference of potentials, which can provide more heuristic information for the learning system to progress rapidly. We also prove the convergence property of Q-value iteration. The heuristic reward function helps to implement an efficient reinforcement learning system on a real-time control or scheduling system.","","0-7803-8273-0","10.1109/WCICA.2004.1342083","","https://ieeexplore.ieee.org/stamp/stamp.jsp?arnumber=1342083","","Space technology;Convergence;Learning systems;Real time systems;Control systems","learning systems;learning (artificial intelligence);Markov processes;decision theory;optimisation;convergence of numerical methods;iterative methods","heuristic reward function;reinforcement learning algorithms;dense functions;sparse reward function;additional reward function;convergence property;Q-value iteration;real time control;real time scheduling system;Markov processes","","1","","","IEEE","18 Oct 2004","","","IEEE","IEEE Conferences"
"Rule driven multi objective dynamic scheduling by data envelopment analysis and reinforcement learning","Xili Chen; XinChang Hao; Hao Wen Lin; Tomohiro Murata","Graduate School of Information, Production and System, Waseda University of Japan, Fukuoka, Japan; Graduate School of Information, Production and System, Waseda University of Japan, Fukuoka, Japan; Graduate School of Information, Production and System, Waseda University of Japan, Fukuoka, Japan; Graduate School of Information, Production and System, Waseda University of Japan, Fukuoka, Japan","2010 IEEE International Conference on Automation and Logistics","23 Sep 2010","2010","","","396","401","This paper presents a rule driven method of developing composite dispatching rule for multi objective dynamic scheduling. Data envelopment analysis is adopted to select elementary dispatching rules, where each rule is justified as efficient for optimizing specific operational objectives of interest. The selected rules are subsequently combined into a single composite rule using the weighted aggregation manner. An intelligent agent is trained using reinforcement learning to acquire the scheduling knowledge of assigning the appropriate weighting values for building the composite rule to cope with the WIP fluctuation of a machine. Implementation of the proposed method in a two objective dynamic job shop scheduling problem is demonstrated and the results are satisfactory.","2161-816X","978-1-4244-8376-1","10.1109/ICAL.2010.5585316","","https://ieeexplore.ieee.org/stamp/stamp.jsp?arnumber=5585316","multi objective scheduling;dynamic job shop;composite dispatching rule;data envelopment analysis;reinforcement learning","Dispatching;Dynamic scheduling;Job shop scheduling;Learning;Intelligent agent;Fluctuations;Data envelopment analysis","data envelopment analysis;job shop scheduling;learning (artificial intelligence)","multiobjective dynamic scheduling;data envelopment analysis;reinforcement learning;rule driven method;WIP fluctuation;job shop scheduling;composite dispatching rule","","7","","14","IEEE","23 Sep 2010","","","IEEE","IEEE Conferences"
"Adaptive V2X platform for guaranteed QoS/QoE service based on cloud computing and deep reinforcement learning","B. Jo; S. Jeong","Dept. IT application research center, Korea Electronics Technology Institute, Republic of Korea; Dept. IT application research center, Korea Electronics Technology Institute, Republic of Korea","2021 Twelfth International Conference on Ubiquitous and Future Networks (ICUFN)","13 Sep 2021","2021","","","23","25","An industry where technology pushes behind and the market pulls ahead succeeds. In this repect, autonomous driving is a global industry that is rapidly growing in line with the advancement of wireless communication, vision, AI technologies and the smart infrastructure market, including automobiles. In particular, V2X technology is an international communication standard for providing autonomous driving services at the level of mobility 4.0. In this paper, we propose an adaptive V2X service methodology. Autonomous driving is a technology belonging to the MCS field which is directly connected to human life, so we provide enhanced QoS/QoE through proposed method which is guaranteed the real-time based on V2X standard.","2165-8536","978-1-7281-6476-2","10.1109/ICUFN49451.2021.9528541","","https://ieeexplore.ieee.org/stamp/stamp.jsp?arnumber=9528541","Mobility 4.0;autonomous driving;adaptive V2X;cloud computing;real-time streaming;MCS","Industries;Wireless communication;Cloud computing;Quality of service;Switches;Reinforcement learning;Real-time systems","cloud computing;learning (artificial intelligence);quality of service","Adaptive V2X platform;cloud computing;deep reinforcement learning;repect;global industry;wireless communication;AI technologies;smart infrastructure market;international communication standard;autonomous driving services;adaptive V2X service methodology","","","","7","IEEE","13 Sep 2021","","","IEEE","IEEE Conferences"
"A novel learning classifier system based on reinforcement learning","Yang Gao; Ning Li; Xin Lu; Shifu Chen","Nanjing University, China; Nanjing University, China; Nanjing University, China; Nanjing University, China","The 2002 International Conference on Control and Automation, 2002. ICCA. Final Program and Book of Abstracts.","8 Sep 2003","2002","","","132","132","","","0-7803-7412-6","10.1109/ICCA.2002.1229428","","https://ieeexplore.ieee.org/stamp/stamp.jsp?arnumber=1229428","","Learning;Control systems;Neural networks;Remote monitoring;Three-term control;Java;Neurons;Internet;Field buses;Web server","","","","","","","IEEE","8 Sep 2003","","","IEEE","IEEE Conferences"
"Reinforcement learning based on on-line state features learning and bias exploration","Xueyong Li; Yaping Lin",Hunan University; Hunan University,"The 2002 International Conference on Control and Automation, 2002. ICCA. Final Program and Book of Abstracts.","8 Sep 2003","2002","","","245","246","","","0-7803-7412-6","10.1109/ICCA.2002.1229820","","https://ieeexplore.ieee.org/stamp/stamp.jsp?arnumber=1229820","","Learning;Control systems;Optimal control;Iterative methods;Frequency domain analysis;Orbital robotics;Space shuttles;Nonlinear control systems;Testing;Performance analysis","","","","","","","IEEE","8 Sep 2003","","","IEEE","IEEE Conferences"
"Reinforcement Learning based Condition-oriented Maintenance Scheduling for Flow Line Systems","R. Lamprecht; F. Wurst; M. F. Huber","Fraunhofer IPA, Center for Cyber Cognitive Intelligence (CCI), Stuttgart, Germany; Fraunhofer IPA, Center for Cyber Cognitive Intelligence (CCI), Stuttgart, Germany; Institute of Industrial Manufacturing and Management IFF, University of Stuttgart, Center for Cyber Cognitive Intelligence (CCI), Fraunhofer IPA, Stuttgart, Germany","2021 IEEE 19th International Conference on Industrial Informatics (INDIN)","11 Oct 2021","2021","","","1","7","Maintenance scheduling is a complex decision-making problem in the production domain, where a number of maintenance tasks and resources has to be assigned and scheduled to production entities in order to prevent unplanned production downtime. Intelligent maintenance strategies are required that are able to adapt to the dynamics and different conditions of production systems. The paper introduces a deep reinforcement learning approach for condition-oriented maintenance scheduling in flow line systems. Different policies are learned, analyzed and evaluated against a benchmark scheduling heuristic based on reward modelling. The evaluation of the learned policies shows that reinforcement learning based maintenance strategies meet the requirements of the presented use case and are suitable for maintenance scheduling in the shop floor.","","978-1-7281-4395-8","10.1109/INDIN45523.2021.9557373","","https://ieeexplore.ieee.org/stamp/stamp.jsp?arnumber=9557373","Reinforcement Learning;DDQN;Maintenance Scheduling;Policy Evaluation","Production systems;Analytical models;Job shop scheduling;Conferences;Decision making;Reinforcement learning;Maintenance engineering","decision making;deep learning (artificial intelligence);maintenance engineering;production engineering computing;scheduling","deep reinforcement learning approach;flow line systems;based condition-oriented maintenance scheduling;complex decision-making problem;production domain systems;intelligent maintenance tasks;benchmark scheduling heuristic","","","","22","IEEE","11 Oct 2021","","","IEEE","IEEE Conferences"
"Research and Application of 45G Antenna Weight Optimization Based on Heuristic and Reinforcement Learning","C. Zhang; F. Gao; W. Zhu; Y. Wu","China Mobile Group Design Institute Co.,Ltd, Beijing, China; China Mobile Group Design Institute Co.,Ltd, Beijing, China; China Mobile Group Design Institute Co.,Ltd, Beijing, China; China Mobile Group Design Institute Co.,Ltd, Beijing, China","2022 IEEE International Symposium on Electromagnetic Compatibility & Signal/Power Integrity (EMCSI)","26 Sep 2022","2022","","","101","105","Currently, the main optimization strategies for 45G network antenna weight are to use manual or simple automated method to adjust weight parameters, however, the above two traditional ways have problems such as high maintenance cost, low optimization efficiency and large errors. Therefore, for the purpose of network production efficiency improvement, optimized maintenance cost reduction and achieving the goals of accurate, rapid, efficient and intelligent optimization of antenna weight, the paper focused on 45G massive multiple-input multiple-output antenna weight self-optimization methods based on artificial intelligence technology and massive multiple-input multiple-output array antenna technology. Meanwhile, network data were analyzed in depth and put forward the theoretical research idea by applying reinforcement learning and heuristic learning as the core strategy to drive the weight self-optimization, which is helpful to provide references for the promotion of self-optimization adjustment technology and the evolution of digital intelligence in the antenna field.","","978-1-6654-0929-2","10.1109/EMCSI39492.2022.9889424","","https://ieeexplore.ieee.org/stamp/stamp.jsp?arnumber=9889424","communication technology;array antenna;weight optimization;intelligent algorithm;artificial intelligence","Costs;Heuristic algorithms;Reinforcement learning;Production;Manuals;Maintenance engineering;MIMO","4G mobile communication;5G mobile communication;artificial intelligence;cost reduction;MIMO communication;optimisation;reinforcement learning;telecommunication computing","4G network;5G antenna weight optimization application;5G network;accurate optimization;antenna field;artificial intelligence technology;efficient optimization;heuristic learning;intelligent optimization;low optimization efficiency;maintenance cost;manual weight parameter adjustment method;massive multiple-input multiple-output antenna weight self-optimization;massive multiple-input multiple-output array antenna technology;network data;network production efficiency improvement;optimized maintenance cost reduction;rapid optimization;reinforcement learning;self-optimization adjustment technology;simple automated weight parameter adjustment method;weight parameters","","1","","3","IEEE","26 Sep 2022","","","IEEE","IEEE Conferences"
"Optimal Task Offloading Decision in IIoT Enviornments Using Reinforcement Learning","S. Koo; Y. Lim","Dept. IT Engineering, Sookmyung Women’s Univ, Seoul, South Korea; Dept. IT Engineering, Sookmyung Women’s Univ, Seoul, South Korea","2021 IEEE 3rd Eurasia Conference on IOT, Communication and Engineering (ECICE)","23 Dec 2021","2021","","","86","89","In the Industrial Internet of Things (IIoT), various types of tasks are processed for the small quantity batch production. But there are many challenges due to the limited battery lifespan and computational capabilities of devices. To overcome the limitations, Mobile Edge Computing (MEC) has been introduced. In MEC, a task offloading technique to execute the tasks attracts much attention. A MEC server (MECS) has limited computational capability, which increases the burden on the server and a cellular network if a larger number of tasks are offloaded to the server. It can reduce the quality of service for task execution. Thus, offloading between nearby devices through device-to-device (D2D) communication is drawing attention. We propose the optimal task offloading decision strategy in the MEC and D2D communication architecture. We aim to minimize the energy consumption of devices and task execution delay under delay constraints. To solve the problem, we adopt Q-learning algorithm as one of Reinforcement Learning (RL). Simulation results show that the proposed algorithm outperforms the other methods in terms of energy consumption of devices and task execution delay.","","978-1-6654-4516-0","10.1109/ECICE52819.2021.9645710","National Research Foundation; ","https://ieeexplore.ieee.org/stamp/stamp.jsp?arnumber=9645710","Computation Offloading;Q-Learning;Mobile Edge Computing;Device-to-Device (D2D) Communication;Industrial Internet of Things","Energy consumption;Q-learning;Simulation;Quality of service;Production;Delays;Device-to-device communication","cellular radio;learning (artificial intelligence);mobile computing","IIoT enviornments;Reinforcement Learning;quantity batch production;battery lifespan;Mobile Edge Computing;task offloading technique;MEC server;MECS;computational capability;nearby devices;device-to-device communication;optimal task offloading decision strategy;D2D communication architecture;task execution delay;Q-learning algorithm","","1","","11","IEEE","23 Dec 2021","","","IEEE","IEEE Conferences"
"Simulation of Cross-border E-commerce Supply Chain Coordination Decision Model Based on Reinforcement Learning Algorithm","J. Liu","School of Economics, Zhejiang University of Technology, Hangzhou, China","2023 International Conference on Networking, Informatics and Computing (ICNETIC)","6 Sep 2023","2023","","","429","433","The management of supply chain is based on information sharing, and the supply chain lacking information exchange and sharing is bound to be in a state of management confusion and inefficiency. However, the profit of supply chain node enterprises is not only affected by the retail price, but also by the contract concluded between manufacturers and retailers. For domestic e-commerce, cross-border logistics needs to deliver goods from our warehouses to consumers in other countries, and the logistics cost is high. In this paper, a coordination decision model of cross-border e-commerce supply chain based on RL (Reinforcement Learning) algorithm is proposed. By using the pairing transaction model based on RL, the parameters of the training set data of the final pairing combination are iterated and optimized, and the optimal parameters are obtained, and then the test set data is used for back testing. The simulation results of Q-RL algorithm show that although there are fluctuations in the negotiation process, the overall negotiation result can reach the global optimum, the negotiation time can be greatly shortened, and the conflict resolution efficiency of supply chain production and marketing collaborative planning can be improved. When the benefits shared by customers to other entities are within the scope that integrators and subcontractors are willing to accept, the profits of cross-border e-commerce enterprises will increase with the increase of their own shared benefits, which will reduce the profits of cross-border e-commerce enterprises.","","979-8-3503-1331-4","10.1109/ICNETIC59568.2023.00095","","https://ieeexplore.ieee.org/stamp/stamp.jsp?arnumber=10236673","Reinforcement learning;Cross-border e-commerce;Supply chain;Coordinated decision","Training;Fluctuations;Simulation;Supply chains;Collaboration;Production;Reinforcement learning","contracts;electronic commerce;logistics;pricing;profitability;supply chain management;supply chains","cross-border e-commerce enterprises;cross-border e-commerce supply chain coordination decision model;cross-border logistics;domestic e-commerce;information exchange;information sharing;management confusion;marketing collaborative planning;pairing transaction model;profit;Q-RL algorithm show;Reinforcement Learning algorithm;retail price;retailers;shared benefits;supply chain node enterprises;supply chain production","","","","12","IEEE","6 Sep 2023","","","IEEE","IEEE Conferences"
"Prolonging Robot Lifespan Using Fatigue Balancing with Reinforcement Learning","F. Costa; S. Mozaffari; R. Alirezaee; M. Ahmadi; S. Alirezaee","Electrical and Computer Engineering Department, University of Windsor, Windsor, Canada; Electrical and Computer Engineering Department, University of Windsor, Windsor, Canada; Electrical and Computer Engineering Department, University of Windsor, Windsor, Canada; Electrical and Computer Engineering Department, University of Windsor, Windsor, Canada; Electrical and Computer Engineering Department, University of Windsor, Windsor, Canada","2022 7th International Conference on Mechanical Engineering and Robotics Research (ICMERR)","12 Apr 2023","2022","","","45","50","Over the last quarter century, industrial robots have become an indispensable element in modern manufacturing and assembly. While the costs of implementing these robot systems can be high, over time these expenditures are offset by their longevity and productivity. One of the major costs of existing robotic systems is the maintenance and replacement of individual robots. Currently, process and manufacturing robots are programmed by robotic technicians with predetermined motions based on process requirements and product specifications. These repetitive motions tend to wear out specific joints faster than others, causing total robot failure and precipitating the replacement of the entire robot. This paper leverages machine learning algorithms to modify nonproduction critical robot movements to balance the physical load at each joint, with the goal of extending the useful life of these industrial robots in a manufacturing environment. Experimental results show that Q-Learning balanced the average load on robot joints by roughly 14%.","","978-1-6654-9051-1","10.1109/ICMERR56497.2022.10097795","","https://ieeexplore.ieee.org/stamp/stamp.jsp?arnumber=10097795","Industrial Robots lifespan;Robot Fatigue;robot motor wear;load balancing on robot joints;Reinforcement learning in robotics","Productivity;Costs;Q-learning;Machine learning algorithms;Service robots;Maintenance engineering;Fatigue","control engineering computing;industrial robots;production engineering computing;reinforcement learning","assembly;fatigue balancing;industrial robots;machine learning;manufacturing environment;manufacturing robots;modern manufacturing;nonproduction critical robot movements;process requirements;product specifications;productivity;Q-learning;reinforcement learning;robot joints;robot lifespan;robotic systems;total robot failure","","","","18","IEEE","12 Apr 2023","","","IEEE","IEEE Conferences"
"Genetic reinforcement learning approach to the machine scheduling problem","G. H. Kim; C. S. G. Lee","School of Electrical Engineering, Purdue University, West Lafayette, IN, USA; School of Electrical Engineering, Purdue University, West Lafayette, IN, USA","Proceedings of 1995 IEEE International Conference on Robotics and Automation","6 Aug 2002","1995","1","","196","201 vol.1","This paper focuses on the development of a learning-based heuristic for the machine scheduling problem, which automatically captures the search control knowledge or the common features of good schedules while generating a number of schedules. Defining states and actions of the machine shop, the machine scheduling problem is transformed into a problem of reinforcement learning (RL) in which a learner or a scheduler will learn to select the right action at each state of the machine shop, using the reward from a schedule evaluator for executing the action. Implementing the proposed reinforcement learning with a genetic algorithm results in the genetic reinforcement learning (GRL) approach to the machine scheduling problem. Although the learning-based heuristic has the overhead of acquiring knowledge on the problem, it can be easily adapted for a wide variety of machine scheduling problems due to the weak dependence on the problem structures and objectives. A GRL-based scheduler, called EVIS (Evolutionary Intracell Scheduler), has been developed and applied to various classes of machine scheduling problems, such as the job-shop scheduling, the flow-shop scheduling and the open-shop scheduling problems, and even the processor scheduling problem, the performance evaluation of EVIS with a number of different problem instances has shown that the learning-based heuristic is robust and its performance is comparable with that of other problem-specific heuristics or search-oriented heuristics in the quality of solutions.","1050-4729","0-7803-1965-6","10.1109/ROBOT.1995.525285","","https://ieeexplore.ieee.org/stamp/stamp.jsp?arnumber=525285","","Job shop scheduling;Machine shops;Genetic algorithms;Machine learning;Robustness;Costs;Intelligent manufacturing systems;Robotics and automation;Design methodology;Problem-solving","production control;genetic algorithms;learning (artificial intelligence);heuristic programming;search problems","genetic reinforcement learning approach;machine scheduling problem;learning-based heuristic;search control knowledge;schedule evaluator;genetic algorithm;EVIS;Evolutionary Intracell Scheduler;job-shop scheduling;flow-shop scheduling;open-shop scheduling;processor scheduling","","12","","21","IEEE","6 Aug 2002","","","IEEE","IEEE Conferences"
