"Policy Gradient-based Integral Reinforcement Learning for Optimal Control Design of Nonaffine Morphing Aircraft Systems","H. Lee; S. -H. Kim; Y. Kim","Dept. of Aerospace Engineering, Seoul National University, Seoul, Republic of Korea; Dept. of Aerospace Engineering, Seoul National University, Seoul, Republic of Korea; Dept. of Aerospace Engineering, Seoul National University, Seoul, Republic of Korea","2020 28th Mediterranean Conference on Control and Automation (MED)","1 Sep 2020","2020","","","218","223","An online model-free optimal control design strategy is proposed for general continuous-time nonlinear nonaffine systems using policy gradient-based integral reinforcement learning. In the case of the nonaffine system such as a morphing wing aircraft considering the morphing parameters as control effectors, general nonlinear control design method cannot be applied and solving the Hamilton-Jacobi-Bellman equation analytically is difficult. The proposed online optimal control algorithm is constructed based on the actor-critic structure using Q-function and policy gradient scheme and the integral reinforcement learning approach is used to develop the actor-critic parameter estimation for the continuous-time system. The closed-loop stability analysis for the designed method is presented. Through the proposed method, the optimal controller can be designed for the general nonaffine system, which has an advantage in terms of a computational issue for the complex system. Note that the entire dynamic model is not required. Simulation results demonstrate the effectiveness of the proposed scheme.","2473-3504","978-1-7281-5742-9","10.1109/MED48518.2020.9183024","","https://ieeexplore.ieee.org/stamp/stamp.jsp?arnumber=9183024","Aerospace control;Intelligent control systems;Nonlinear control","Optimal control;Mathematical model;Learning (artificial intelligence);Heuristic algorithms;Aircraft;Control design;Aerospace control","adaptive control;aerospace components;aircraft control;closed loop systems;continuous time systems;control system synthesis;gradient methods;learning (artificial intelligence);nonlinear control systems;optimal control;parameter estimation;stability","policy gradient-based integral reinforcement learning;optimal control design;nonaffine morphing aircraft systems;continuous-time nonlinear nonaffine systems;morphing wing aircraft;morphing parameters;control effectors;general nonlinear control design method;optimal control algorithm;policy gradient scheme;integral reinforcement learning approach;actor-critic parameter estimation;continuous-time system;optimal controller;general nonaffine system","","1","","18","IEEE","1 Sep 2020","","","IEEE","IEEE Conferences"
"Multi-Agent Active Search: A Reinforcement Learning Approach","C. Igoe; R. Ghods; J. Schneider","School of Computer Science, Machine Learning Department, Carnegie Mellon University, Pittsburgh, PA, USA; School of Computer Science, the Robotics Institute, Carnegie Mellon University, Pittsburgh, PA, USA; School of Computer Science, Machine Learning Department, Carnegie Mellon University, Pittsburgh, PA, USA","IEEE Robotics and Automation Letters","15 Dec 2021","2022","7","2","754","761","Multi-Agent Active Search (MAAS) is an active learning problem with the objective of locating sparse targets in an unknown environment by actively making data-collection decisions. Recently proposed algorithms, although well-motivated from a theoretical perspective, are limited in three key ways: they are either explicitly myopic (e.g. with respect to information gain) or introduce strong biases that fall short of fully non-myopic behaviour; they employ general-purpose coordination mechanisms to scale to multi-agent settings without optimising for any specific agent configuration; and they involve significant online computation to determine suitable sensing regions. In this letter, we introduce a Poisson Point Process formulation and cast MAAS as a Reinforcement Learning problem, learning policies in belief space of the associated POMDP. We demonstrate how such an approach can overcome each of the three issues of previous algorithms and is surprisingly robust to test-time miscommunication.","2377-3766","","10.1109/LRA.2021.3131697","Army Research Office; U.S. Army Futures Command(grant numbers:W911NF-20-D-0002); ","https://ieeexplore.ieee.org/stamp/stamp.jsp?arnumber=9632368","Aerial systems: perception and autonomy;reinforcement learning;multi-robot systems","Search problems;Sensors;Task analysis;Robot sensing systems;Training;Reinforcement learning;Optimization","control engineering computing;data acquisition;mobile robots;multi-agent systems;multi-robot systems;reinforcement learning;search problems;stochastic processes","multiagent active search;MAAS;active learning;data-collection decisions;agent configuration;reinforcement learning;sparse targets;information gain;fully nonmyopic behaviour;general-purpose coordination;online computation;sensing regions;Poisson point process formulation;learning policies;belief space;POMDP;test-time miscommunication;multirobot systems","","1","","21","CCBY","1 Dec 2021","","","IEEE","IEEE Journals"
"Toward Observation Based Least Restrictive Collision Avoidance Using Deep Meta Reinforcement Learning","S. Asayesh; M. Chen; M. Mehrandezh; K. Gupta","Faculty of Applied Science, Simon Fraser University, Burnaby, BC, Canada; Faculty of Applied Science, Simon Fraser University, Burnaby, BC, Canada; Faculty of Engineering and Applied Science, University of Regina, Regina, SK, Canada; Faculty of Applied Science, Simon Fraser University, Burnaby, BC, Canada","IEEE Robotics and Automation Letters","3 Aug 2021","2021","6","4","7445","7452","This letter presents the Observation-based Least-Restrictive Collision Avoidance Module (OLR-CAM) that can be added to any autonomous robot working in a shared environment and provide a high-level safety layer to the existing policy for each robot. The OLR-CAM takes raw sensory observations as input, evaluates the agents' safety against dynamic and static obstacles, and only intervenes the default policy when needed - in a least-restrictive fashion - to avoid a potential collision. In our approach, we meta-train the OLR-CAM policy within a “2D Navigation Meta World System”. Furthermore, to endow the policy with a notion of safety in multi-agent environments with obstacles, we propose a novel reward function based on a safety value function derived from the Hamilton-Jacobi reachability theory and a local cost map. The proposed reward function does not need any additional information about the environment's map. This facilitates the adoption of the algorithm in a new environment at the meta test stage. The proposed algorithm is fully meta-trained in simulation and tested on a real multi-agent system without any additional training conducted in the real setting. Our results show that the OLR-CAM success rate outperforms a well-known classical baseline approach by 10 percent on average and reduces the interruptions/changes to the preferred velocity by 15 percent.","2377-3766","","10.1109/LRA.2021.3098332","","https://ieeexplore.ieee.org/stamp/stamp.jsp?arnumber=9492812","Collision avoidance;reinforcement learning;optimization and optimal control","Collision avoidance;Safety;Heuristic algorithms;Task analysis;Navigation;Reinforcement learning;Multi-agent systems","collision avoidance;deep learning (artificial intelligence);mobile robots;multi-agent systems;reachability analysis","safety value function;Hamilton-Jacobi reachability theory;local cost map;reward function;meta test stage;multiagent system;OLR-CAM success rate;collision avoidance module;autonomous robot;shared environment;high-level safety layer;raw sensory observations;dynamic obstacles;static obstacles;default policy;least-restrictive fashion;OLR-CAM policy;2D Navigation Meta World System;multiagent environments;Observation-based Least-Restrictive Collision Avoidance Module;deep meta reinforcement learning;efficiency 10.0 percent;efficiency 15.0 percent","","1","","30","IEEE","21 Jul 2021","","","IEEE","IEEE Journals"
"Interactive Reinforcement Learning with Inaccurate Feedback","T. A. Kessler Faulkner; E. Schaertl Short; A. L. Thomaz","Department of Computer Science, The University of Texas at Austin, Austin, TX, USA; Department of Computer Science, Tufts University, Medford, MA, USA; Department of Electrical and Computer Engineering, The University of Texas of Austin, Austin, TX, USA","2020 IEEE International Conference on Robotics and Automation (ICRA)","15 Sep 2020","2020","","","7498","7504","Interactive Reinforcement Learning (RL) enables agents to learn from two sources: rewards taken from observations of the environment, and feedback or advice from a secondary critic source, such as human teachers or sensor feedback. The addition of information from a critic during the learning process allows the agents to learn more quickly than non-interactive RL. There are many methods that allow policy feedback or advice to be combined with RL. However, critics can often give imperfect information. In this work, we introduce a framework for characterizing Interactive RL methods with imperfect teachers and propose an algorithm, Revision Estimation from Partially Incorrect Resources (REPaIR), which can estimate corrections to imperfect feedback over time. We run experiments both in simulations and demonstrate performance on a physical robot, and find that when baseline algorithms do not have prior information on the exact quality of a feedback source, using REPaIR matches or improves the expected performance of these algorithms.","2577-087X","978-1-7281-7395-5","10.1109/ICRA40945.2020.9197219","","https://ieeexplore.ieee.org/stamp/stamp.jsp?arnumber=9197219","","Maintenance engineering;Robot sensing systems;Estimation;Task analysis;Learning (artificial intelligence);Computer science","feedback;interactive systems;learning (artificial intelligence);mobile robots","interactive reinforcement learning;human teachers;sensor feedback;learning process;noninteractive RL;policy feedback;feedback source;interactive RL methods;revision estimation-from-partially incorrect resources;REPaIR;physical robot","","1","","22","IEEE","15 Sep 2020","","","IEEE","IEEE Conferences"
"A Reinforcement Learning Approach in Assignment of Task Priorities in Kinematic Control of Redundant Robots","M. Karimi; M. Ahmadi","Department of Mechanical and Aerospace Engineering, Carleton University, Ottawa, ON, Canada; Department of Mechanical and Aerospace Engineering, Carleton University, Ottawa, ON, Canada","IEEE Robotics and Automation Letters","21 Dec 2021","2022","7","2","850","857","Based on the recent advances of Deep Reinforcement Learning (DRL) and promising results, in this paper, we propose a framework for strict priority assignment in the context of kinematic control of redundant robots. The presented method focuses on redundant robots performing multiple concurrent tasks with potentially conflicting requirements and learns how to re-assign task priorities to ensure critical tasks get executed through smooth transitions. A Deep Q-Network (DQN) reinforcement learning agent is trained to assign the proper strict priorities to a stack of predefined kinematic control tasks (e.g., position control, orientation control, obstacle avoidance control, etc.) in a varying environment. Furthermore, to address the discontinuities in the control law due to the changes in the task priorities, a smoothing algorithm is proposed to ensure continuous reference velocities to the robot’s joints. The proposed method is generic and extendable to a higher number of tasks and can be used when a reordering, swapping, addition, or deletion of tasks is required. The effectiveness of the proposed method is shown in simulation on a 5-DoF planar manipulator and a 7-DoF planar bipedal robot. The results show that the DRL agent is successful in assigning the correct hierarchy of tasks at each robot’s state based on the global goal of the robot.","2377-3766","","10.1109/LRA.2021.3133934","Natural Sciences and Engineering Research Council of Canada(grant numbers:RGPIN-2015-04169); ","https://ieeexplore.ieee.org/stamp/stamp.jsp?arnumber=9645158","Machine learning for robot control;reinforcement learning;redundant robots;bipedal locomotion","Task analysis;Robots;Null space;Kinematics;Robot kinematics;Jacobian matrices;Training","collision avoidance;legged locomotion;motion control;redundant manipulators;reinforcement learning","redundant robots;strict priority assignment;multiple concurrent tasks;re-assign task priorities;smooth transitions;proper strict priorities;position control;orientation control;obstacle avoidance control;7-DoF planar bipedal robot;DRL agent;deep Q-network reinforcement learning agent;kinematic control tasks;5-DoF planar manipulator","","","","29","IEEE","10 Dec 2021","","","IEEE","IEEE Journals"
"Evaluating Adaptation Performance of Hierarchical Deep Reinforcement Learning","N. Van Stolen; S. Hyun Kim; H. T. Tran; G. Chowdhary","University of Illinois at Urbana-Champaign, IL, USA; University of Illinois at Urbana-Champaign, IL, USA; University of Illinois at Urbana-Champaign, IL, USA; University of Illinois at Urbana-Champaign, IL, USA","2020 IEEE International Conference on Robotics and Automation (ICRA)","15 Sep 2020","2020","","","11457","11463","Deep Reinforcement Learning has been used to exploit specific environments, but has difficulty transferring learned policies to new situations. This issue poses a problem for practical applications of Reinforcement Learning, as real-world scenarios may introduce unexpected differences that drastically reduce policy performance. We propose the use of differentiated sub-policies governed by a hierarchical controller to support adaptation in such scenarios. We also introduce a confidence- based training process for the hierarchical controller which improves training stability and convergence times. We evaluate these methods in a new Capture the Flag environment designed to explore adaptation in autonomous multi-agent settings.","2577-087X","978-1-7281-7395-5","10.1109/ICRA40945.2020.9197052","","https://ieeexplore.ieee.org/stamp/stamp.jsp?arnumber=9197052","","Training;Adaptation models;Trajectory;Games;Learning (artificial intelligence);Robots;Switches","learning (artificial intelligence);multi-agent systems;neural nets","differentiated sub-policies;hierarchical controller;adaptation performance;hierarchical deep reinforcement learning;policy performance;confidence- based training process","","","","24","IEEE","15 Sep 2020","","","IEEE","IEEE Conferences"
"Developing Cooperative Policies for Multi-Stage Reinforcement Learning Tasks","J. Erskine; C. Lehnert","Queensland University of Technology, Brisbane, QLD, Australia; Queensland University of Technology, Brisbane, QLD, Australia","IEEE Robotics and Automation Letters","25 May 2022","2022","7","3","6590","6597","Many hierarchical reinforcement learning algorithms utilise a series of independent skills as a basis to solve tasks at a higher level of reasoning. These algorithms don’t consider the value of using skills that are cooperative instead of independent. This paper proposes the Cooperative Consecutive Policies (CCP) method of enabling consecutive agents to cooperatively solve long time horizon multi-stage tasks. This method is achieved by modifying the policy of each agent to maximise both the current and next agent’s critic. Cooperatively maximising critics allows each agent to take actions that are beneficial for its task as well as subsequent tasks. Using this method in a multi-room maze domain and a peg in hole manipulation domain, the cooperative policies were able to outperform a set of naive policies, a single agent trained across the entire domain, as well as another sequential HRL algorithm.","2377-3766","","10.1109/LRA.2022.3174258","","https://ieeexplore.ieee.org/stamp/stamp.jsp?arnumber=9772966","Reinforcement learning","Task analysis;Reinforcement learning;Training;Grasping;Navigation;Entropy;Cognition","multi-agent systems;optimisation;reinforcement learning","CCP;consecutive agents;cooperative consecutive policies;hole manipulation domain;long time horizon multistage tasks;multiroom maze domain;multistage reinforcement learning","","","","29","IEEE","11 May 2022","","","IEEE","IEEE Journals"
"Robotic Embodiment of Human-Like Motor Skills via Reinforcement Learning","L. Guzman; V. Morellas; N. Papanikolopoulos","Department of Computer Science and Engineering, University of Minnesota, Minneapolis, MN, USA; Department of Electrical and Computer Engineering, University of Minnesota, Minneapolis, MN, USA; Department of Computer Science and Engineering, University of Minnesota, Minneapolis, MN, USA","IEEE Robotics and Automation Letters","15 Feb 2022","2022","7","2","3711","3717","Current methods require robots to be reprogrammed for every new task, consuming many engineering resources. This work focuses on integrating real and simulated environments for our proposed “Internet of Skills,” which enables robots to learn advanced skills from a small set of expert demonstrations. By expanding on recent work in the areas of Learning from Demonstrations (LfD) and Reinforcement Learning (RL), we can train robot control policies that can not only effectively complete a given task but also do so with greater performance than the expert demonstrations used to train the policy. In this work, we create simulated environments to train RL algorithms for the task of inverse kinematics and obstacle avoidance. Many state-of-the-art RL algorithms are compared, and we provide a detailed analysis of the state space and parameters chosen. Lastly, we utilize a Vicon motion tracking system and train the robot agent to follow trajectories given by a human operator. Our results show that reinforcement learning algorithms such as proximal policy optimization can develop control policies that are capable of complex control tasks that integrate with the real world, an important first step towards developing a system that can autonomously learn new skills from human demonstrations.","2377-3766","","10.1109/LRA.2022.3147453","Minnesota Robotics Institute (MnRI), Honeywell; National Science Foundation(grant numbers:CNS-1439728,CNS-1531330,CNS-1939033); USDA/NIFA(grant numbers:2020-67021-30755); ","https://ieeexplore.ieee.org/stamp/stamp.jsp?arnumber=9699095","Telerobotics and teleoperation;reinforcement learning;transfer learning;model learning for control;collision avoidance","Robots;Task analysis;Robot kinematics;Reinforcement learning;Training;Collision avoidance;Virtual environments","collision avoidance;mobile robots;motion control;multi-robot systems;reinforcement learning;robot kinematics","robotic embodiment;human-like motor Skills;engineering resources;robot control policies;RL algorithms;Vicon motion tracking system;human operator;reinforcement learning algorithms;proximal policy optimization;human demonstrations;learning from demonstrations;LfD;inverse kinematics;obstacle avoidance","","","","20","IEEE","1 Feb 2022","","","IEEE","IEEE Journals"
"Switching Decision of Air-Ground Amphibious Robot using Neural Network-based Reinforcement Learning","Z. Liu; Y. Liu","School of Computer Science and Engineering, Nanjing University of Science and Technology, Nanjing, China; School of Computer Science and Engineering, Nanjing University of Science and Technology, Nanjing, China","2019 IEEE 9th Annual International Conference on CYBER Technology in Automation, Control, and Intelligent Systems (CYBER)","16 Apr 2020","2019","","","883","888","This paper studies the problem of autonomous decision-making motion mode switching based on external environmental information when the Air-Ground Amphibious Robot is in complex environment. In the process of robot autonomous decision-making, the limitation of motion time and energy consumption should be considered, and the motion state with short motion time and low energy consumption should be selected. In this paper, the methods of reinforcement learning based on neural network are put forward to solve the problem of intelligent switching decision of the Air-Ground Amphibious Robot, aiming at making the robot choose the appropriate mode to move in a certain state of environment. Reinforcement learning based on neural network can not only generate decision function in the process of learning, but also solve the reinforcement problem of continuous environment state space. When a robot performs a task, it is important to reduce the energy consumption of motion. Therefore, this paper takes the energy consumption and motion time as the basis of robot decision-making and the standard of motion evaluation. In this paper, we provide the simulation results and demonstrate the feasibility of our method, which can effectively realize the high-efficiency motion ability of the Air-Ground Amphibious Robot in the complex environment.","2379-7711","978-1-7281-0770-7","10.1109/CYBER46603.2019.9066633","","https://ieeexplore.ieee.org/stamp/stamp.jsp?arnumber=9066633","","Learning (artificial intelligence);Energy consumption;Robot kinematics;Decision making;Mobile robots;Switches","aerospace control;decision making;learning (artificial intelligence);mobile robots;motion control;multi-robot systems","intelligent switching decision;short motion time;motion state;robot autonomous decision-making;autonomous decision-making motion mode;neural network-based reinforcement learning;complex environment;air-ground amphibious robot;robot decision-making;energy consumption","","","","15","IEEE","16 Apr 2020","","","IEEE","IEEE Conferences"
"A multi-agent deep reinforcement learning framework for automated driving on highways","L. Bakker; S. Grammatico","Delft Center for Systems and Control, TU Delft, The Netherlands; Delft Center for Systems and Control, TU Delft, The Netherlands","2020 28th Mediterranean Conference on Control and Automation (MED)","1 Sep 2020","2020","","","770","775","We apply deep reinforcement learning to automated driving on highways. We propose a novel, simple framework with improved performance with respect to the state of the art. When implementing our algorithm on multilane highway scenarios, after the training phase, we observe via numerical simulations that the vehicles are able to avoid collisions and to reach their respective destination lanes with very high probability.","2473-3504","978-1-7281-5742-9","10.1109/MED48518.2020.9182882","","https://ieeexplore.ieee.org/stamp/stamp.jsp?arnumber=9182882","","Road transportation;Training;Multi-agent systems;Machine learning;Control systems;Aerospace electronics;Learning (artificial intelligence)","learning (artificial intelligence);multi-agent systems;probability;traffic engineering computing","multiagent deep reinforcement learning framework;automated driving;multilane highway scenarios","","","","21","IEEE","1 Sep 2020","","","IEEE","IEEE Conferences"
"Wheel Loader Scooping Controller Using Deep Reinforcement Learning","O. Azulay; A. Shapiro","School of Mechanical Engineering, Tel Aviv University, Tel Aviv, Israel; Department of Mechanical Engineering, Ben-Gurion University of the Negev, Be’er Sheva, Israel","IEEE Access","9 Feb 2021","2021","9","","24145","24154","This article presents a deep reinforcement learning-based controller for an unmanned ground vehicle with a custom-built scooping mechanism. The robot's aim is to autonomously perform earth scooping cycles with three degrees of freedom: lift, tilt and the robot's velocity. While the majority of previous studies on automated scooping processes are based on data recorded by expert operators, we present a method to autonomously control a wheel loader to perform the scooping cycle using deep reinforcement learning methods without any user-provided demonstrations. The controller's learning approach is based on the actorcritic, Deep Deterministic Policy Gradient algorithm which we use to map online sensor data as input to continuously update the actuator commands. The training of the scooping policy network is done solely in a simplified simulation environment using a virtual physics engine, which converges to an average of a 65% fill factor from the full bucket capacity and a 5 [sec] average cycle time. We illustrate the performance of the trained policy in simulations and in real-world experiments with 3 different inclination angles of the earth. An additional scooping experiment compared the performance of our controller to remote manual human control. Overall, the deep reinforcement learning-based controller exhibited good performance in terms of both achieved visually bucket fill with varying scooped earth weights of 4.1 - 7.2[kg], and a 5.1 - 7.1[sec] cycle time. The experimental results confirm the ability of our planner to fill bucket as required, indicating that our controller can be used for excavation purposes.","2169-3536","","10.1109/ACCESS.2021.3056625","Israeli Ministry of Defense through Project ROBIL(grant numbers:87726311); ","https://ieeexplore.ieee.org/stamp/stamp.jsp?arnumber=9344588","Robotics in construction;machine learning;agricultural automation","Wheels;Trajectory;Robots;Reinforcement learning;Earth;Task analysis;Soil","excavators;learning (artificial intelligence);manipulator dynamics;mobile robots;remotely operated vehicles","scooping cycle;deep reinforcement learning methods;learning approach;deep deterministic policy gradient algorithm;scooping policy network;average cycle time;trained policy;remote manual human control;scooped earth weights;wheel loader scooping controller;unmanned ground vehicle;automated scooping processes;deep reinforcement learning-based controller","","23","","27","CCBY","2 Feb 2021","","","IEEE","IEEE Journals"
