"Discovering an Aid Policy to Minimize Student Evasion Using Offline Reinforcement Learning","L. M. De Lima; R. A. Krohling","Graduate Program in Computer Science PPGI, Federal University of Espirito Santo, UFES, Vitória, Brazil; Production Engineering Department, Graduate Program in Computer Science PPGI LABCIN, Federal University of Espirito Santo, UFES, Vitória, Brazil","2021 International Joint Conference on Neural Networks (IJCNN)","22 Sep 2021","2021","","","1","8","High dropout rates in tertiary education expose a lack of efficiency that causes frustration of expectations and financial waste. Predicting students at risk is not enough to avoid student dropout. Usually, an appropriate aid action must be discovered and applied in the proper time for each student. To tackle this sequential decision-making problem, we propose a decision support method to the selection of aid actions for students using offline reinforcement learning to support decision-makers effectively avoid student dropout. Additionally, a discretization of student's state space applying two different clustering methods is evaluated. Our experiments using logged data of real students shows, through off-policy evaluation, that the method should achieve roughly 1.0 to 1.5 times as much cumulative reward as the logged policy. So, it is feasible to help decision-makers apply appropriate aid actions and, possibly, reduce student dropout.","2161-4407","978-1-6654-3900-8","10.1109/IJCNN52387.2021.9534159","","https://ieeexplore.ieee.org/stamp/stamp.jsp?arnumber=9534159","","Clustering methods;Neural networks;Education;Decision making;Clustering algorithms;Reinforcement learning;Principal component analysis","","","","","","43","IEEE","22 Sep 2021","","","IEEE","IEEE Conferences"
"Reinforcement learning approach to locomotion adaptation in sloped environments","J. André; L. Costa; C. Santos","Department of Industrial Electronics, University of Minho; Department of Production and Systems, University of Minho; Department of Industrial Electronics, University of Minho","2014 IEEE International Conference on Autonomous Robot Systems and Competitions (ICARSC)","10 Jul 2014","2014","","","164","169","In this work, Path Integral Policy Improvement with Covariance Matrix Adaptation (PI2-CMA) is implemented and used to address biped locomotion optimization. Central Pattern Generators (CPGs) and Dynamic Movement Primitives (DMPs) are combined to easily produce complex joint trajectories for simulated DARwIn-OP humanoid robot. PI2-CMA seeks optimal DMPs' weights that maximize frontal velocity when facing different challenges. The simulation environments demand adaptation from the controller in order to successfully walk in different slopes. Elitism was introduced in PI2-CMA in order to improve the convergence property of the algorithm. Results show that these approaches enabled easy adaptation of DARwIn-OP to new situations. The results are very promising and demonstrate the flexibility at generating new trajectories for locomotion.","","978-1-4799-4254-1","10.1109/ICARSC.2014.6849780","","https://ieeexplore.ieee.org/stamp/stamp.jsp?arnumber=6849780","","Legged locomotion;Trajectory;Joints;Convergence;Generators;Hip","covariance matrices;humanoid robots;learning (artificial intelligence);legged locomotion;motion control;trajectory control","reinforcement learning approach;locomotion adaptation;sloped environment;path integral policy improvement with covariance matrix adaptation;PI2-CMA;biped locomotion optimization;central pattern generators;CPG;dynamic movement primitives;DMP;DARwIn-OP humanoid robot;trajectory generation","","","","21","IEEE","10 Jul 2014","","","IEEE","IEEE Conferences"
"Dynamic provisioning of airport resources for inbound passenger flow using reinforcement learning","R. Suriyanarayanan; Y. S. Chati; A. Vasan","TCS Research, IIT Madras Research Park, Chennai, India; TCS Research, IIT Madras Research Park, Chennai, India; TCS Research, IIT Madras Research Park, Chennai, India","2022 IEEE 25th International Conference on Intelligent Transportation Systems (ITSC)","1 Nov 2022","2022","","","619","626","Correct provisioning of resources can help airports reduce cost of operations while ensuring quality of service seen by passengers. Specifically, dynamic provisioning of resources is needed to handle varying passenger loads that are subject to increased uncertainties due to the pandemic. Classical optimization methods could be computationally expensive; and rule-based heuristics that are well-tuned for normal operating conditions could be sub-optimal during periods of rapid change. We complement existing works with a Reinforcement Learning (RL)-based approach for dynamic provisioning of airport resources. Specifically, we consider the problem of jointly provisioning immigration and medical screening resources for inbound passenger flow. Our approach uses a state representation that encodes the supply and demand of the provisioned resources; and a reward engineered to capture the resource cost vs passenger delay trade-off. As baselines, we use two heuristics that statically and dynamically provision resources. We evaluate our approach on a simulated airport environment calibrated with real-world data. In scenarios that statistically significantly differ from the learning dataset, RL achieves up to ~20X decrease in passenger delay when compared to the heuristics for up to ~1.6X increase in resource cost.","","978-1-6654-6880-0","10.1109/ITSC55140.2022.9922383","","https://ieeexplore.ieee.org/stamp/stamp.jsp?arnumber=9922383","","Costs;Supply and demand;Uncertainty;Pandemics;Optimization methods;Reinforcement learning;Quality of service","airports;optimisation;reinforcement learning;service industries","dynamic provisioning;airport resources;inbound passenger flow;reinforcement learning;varying passenger loads;optimization methods;immigration;medical screening resources;resource cost;passenger delay trade-off;simulated airport environment","","","","24","IEEE","1 Nov 2022","","","IEEE","IEEE Conferences"
"Tourism Route Recommendation Using Reinforcement Learning","M. I. Mubarak; Z. K. A. Baizal","School of Computing, Telkom University, Bandung, Indonesia; School of Computing, Telkom University, Bandung, Indonesia","2023 IEEE 8th International Conference for Convergence in Technology (I2CT)","23 May 2023","2023","","","1","7","Tourism is a rapidly growing sector that has a significant impact on increasing a country’s national income. Indonesia’s GDP is expected to grow in the coming years, and tourism is a major contributor to this growth. To address the high demand for tourism, we propose a personalized tourism route recommendation system that can assist tourists in planning their itineraries. This problem can be modeled as a Traveling Salesman Problem, which can be approached using Markov Decision Processes and reinforcement learning. In this paper, we proposed a method for generating N-days tourism routes in the Special Region of Yogyakarta that involves using Q-learning to recommend routes. We have included time constraints in our approach to fit the tour into a specific time frame and adhere to the operating hours of tourist attractions. Additionally, our method uses the Multi-Attribute Utility Theory to consider various attributes, such as rating, travel time, and cost, as cost functions to satisfy the user’s custom desired needs and preferences. The proposed method was compared to the Firefly algorithm in multiple experiments to assess its performance and determine its optimality. The experiment results showed that the proposed method is 42.89% more optimal for generating the tour than the Firefly algorithm.","","979-8-3503-3401-2","10.1109/I2CT57861.2023.10126347","","https://ieeexplore.ieee.org/stamp/stamp.jsp?arnumber=10126347","Reinforcement learning;traveling salesman problem;route recommendation;itinerary planning","Q-learning;Costs;Economic indicators;Utility theory;Traveling salesman problems;Markov processes;Cost function","decision theory;Markov processes;recommender systems;reinforcement learning;travel industry;travelling salesman problems;utility theory","Indonesia;Markov decision processes;multiattribute utility theory;personalized tourism route recommendation system;Q-learning;reinforcement learning;specific time frame;time constraints;traveling salesman problem","","","","19","IEEE","23 May 2023","","","IEEE","IEEE Conferences"
"Deep reinforcement learning for robotic manipulation with asynchronous off-policy updates","S. Gu; E. Holly; T. Lillicrap; S. Levine",MPI Tübingen; Google Brain; Google DeepMind; Google Brain,"2017 IEEE International Conference on Robotics and Automation (ICRA)","24 Jul 2017","2017","","","3389","3396","Reinforcement learning holds the promise of enabling autonomous robots to learn large repertoires of behavioral skills with minimal human intervention. However, robotic applications of reinforcement learning often compromise the autonomy of the learning process in favor of achieving training times that are practical for real physical systems. This typically involves introducing hand-engineered policy representations and human-supplied demonstrations. Deep reinforcement learning alleviates this limitation by training general-purpose neural network policies, but applications of direct deep reinforcement learning algorithms have so far been restricted to simulated settings and relatively simple tasks, due to their apparent high sample complexity. In this paper, we demonstrate that a recent deep reinforcement learning algorithm based on off-policy training of deep Q-functions can scale to complex 3D manipulation tasks and can learn deep neural network policies efficiently enough to train on real physical robots. We demonstrate that the training times can be further reduced by parallelizing the algorithm across multiple robots which pool their policy updates asynchronously. Our experimental evaluation shows that our method can learn a variety of 3D manipulation skills in simulation and a complex door opening skill on real robots without any prior demonstrations or manually designed representations.","","978-1-5090-4633-1","10.1109/ICRA.2017.7989385","","https://ieeexplore.ieee.org/stamp/stamp.jsp?arnumber=7989385","","Robots;Training;Instruction sets;Learning (artificial intelligence);Neural networks;Safety;Heuristic algorithms","learning (artificial intelligence);manipulators","deep reinforcement learning;robotic manipulation;asynchronous off-policy updates;autonomous robots;hand-engineered policy representations;human-supplied demonstration;sample complexity;deep Q-functions;3D manipulation skills","","653","1","42","IEEE","24 Jul 2017","","","IEEE","IEEE Conferences"
"Target-driven visual navigation in indoor scenes using deep reinforcement learning","Y. Zhu; R. Mottaghi; E. Kolve; J. J. Lim; A. Gupta; L. Fei-Fei; A. Farhadi",Stanford University; Allen Institute for AI; Allen Institute for AI; Stanford University; Carnegie Mellon University; Stanford University; Allen Institute for AI,"2017 IEEE International Conference on Robotics and Automation (ICRA)","24 Jul 2017","2017","","","3357","3364","Two less addressed issues of deep reinforcement learning are (1) lack of generalization capability to new goals, and (2) data inefficiency, i.e., the model requires several (and often costly) episodes of trial and error to converge, which makes it impractical to be applied to real-world scenarios. In this paper, we address these two issues and apply our model to target-driven visual navigation. To address the first issue, we propose an actor-critic model whose policy is a function of the goal as well as the current state, which allows better generalization. To address the second issue, we propose the AI2-THOR framework, which provides an environment with high-quality 3D scenes and a physics engine. Our framework enables agents to take actions and interact with objects. Hence, we can collect a huge number of training samples efficiently. We show that our proposed method (1) converges faster than the state-of-the-art deep reinforcement learning methods, (2) generalizes across targets and scenes, (3) generalizes to a real robot scenario with a small amount of fine-tuning (although the model is trained in simulation), (4) is end-to-end trainable and does not need feature engineering, feature matching between frames or 3D reconstruction of the environment.","","978-1-5090-4633-1","10.1109/ICRA.2017.7989381","","https://ieeexplore.ieee.org/stamp/stamp.jsp?arnumber=7989381","","Navigation;Training;Visualization;Learning (artificial intelligence);Three-dimensional displays;Physics;Robots","learning (artificial intelligence);path planning;robot vision","target-driven visual navigation;indoor scenes;deep reinforcement learning;actor-critic model;AI2-THOR framework;high-quality 3D scenes;physics engine;real robot scenario","","613","2","53","IEEE","24 Jul 2017","","","IEEE","IEEE Conferences"
"Neural Network Dynamics for Model-Based Deep Reinforcement Learning with Model-Free Fine-Tuning","A. Nagabandi; G. Kahn; R. S. Fearing; S. Levine","University of California, Berkeley; University of California, Berkeley; University of California, Berkeley; University of California, Berkeley","2018 IEEE International Conference on Robotics and Automation (ICRA)","13 Sep 2018","2018","","","7559","7566","Model-free deep reinforcement learning algorithms have been shown to be capable of learning a wide range of robotic skills, but typically require a very large number of samples to achieve good performance. Model-based algorithms, in principle, can provide for much more efficient learning, but have proven difficult to extend to expressive, high-capacity models such as deep neural networks. In this work, we demonstrate that neural network dynamics models can in fact be combined with model predictive control (MPC) to achieve excellent sample complexity in a model-based reinforcement learning algorithm, producing stable and plausible gaits that accomplish various complex locomotion tasks. We further propose using deep neural network dynamics models to initialize a model-free learner, in order to combine the sample efficiency of model-based approaches with the high task-specific performance of model-free methods. We empirically demonstrate on MuJoCo locomotion tasks that our pure model-based approach trained on just random action data can follow arbitrary trajectories with excellent sample efficiency, and that our hybrid algorithm can accelerate model-free learning on high-speed benchmark tasks, achieving sample efficiency gains of 3-5× on swimmer, cheetah, hopper, and ant agents. Videos can be found at https://sites.google.com/view/mbmf.","2577-087X","978-1-5386-3081-5","10.1109/ICRA.2018.8463189","","https://ieeexplore.ieee.org/stamp/stamp.jsp?arnumber=8463189","","Task analysis;Predictive models;Neural networks;Data models;Heuristic algorithms;Machine learning;Complexity theory","computational complexity;learning (artificial intelligence);neural nets;predictive control","model-free learning;model-free fine-tuning;model-free deep reinforcement learning algorithms;model-based algorithms;model predictive control;model-based reinforcement learning algorithm;complex locomotion tasks;deep neural network dynamics models;model-free learner;model-based approaches;model-free methods;sample complexity;model-based deep reinforcement learning;robotic skills;MPC;plausible gaits;stable gaits","","273","","43","IEEE","13 Sep 2018","","","IEEE","IEEE Conferences"
"Decentralized non-communicating multiagent collision avoidance with deep reinforcement learning","Y. F. Chen; M. Liu; M. Everett; J. P. How","Laboratory of Information and Decision Systems, Massachusetts Institute of Technology, Cambridge, MA, US; IBM Thomas J. Watson Research Center, Yorktown Heights, NY, USA; Laboratory of Information and Decision Systems, Massachusetts Institute of Technology, Cambridge, MA, USA; Laboratory of Information and Decision Systems, Massachusetts Institute of Technology, Cambridge, MA, USA","2017 IEEE International Conference on Robotics and Automation (ICRA)","24 Jul 2017","2017","","","285","292","Finding feasible, collision-free paths for multiagent systems can be challenging, particularly in non-communicating scenarios where each agent's intent (e.g. goal) is unobservable to the others. In particular, finding time efficient paths often requires anticipating interaction with neighboring agents, the process of which can be computationally prohibitive. This work presents a decentralized multiagent collision avoidance algorithm based on a novel application of deep reinforcement learning, which effectively offloads the online computation (for predicting interaction patterns) to an offline learning procedure. Specifically, the proposed approach develops a value network that encodes the estimated time to the goal given an agent's joint configuration (positions and velocities) with its neighbors. Use of the value network not only admits efficient (i.e., real-time implementable) queries for finding a collision-free velocity vector, but also considers the uncertainty in the other agents' motion. Simulation results show more than 26% improvement in paths quality (i.e., time to reach the goal) when compared with optimal reciprocal collision avoidance (ORCA), a state-of-the-art collision avoidance strategy.","","978-1-5090-4633-1","10.1109/ICRA.2017.7989037","","https://ieeexplore.ieee.org/stamp/stamp.jsp?arnumber=7989037","","Collision avoidance;Learning (artificial intelligence);Kinematics;Decision making;Real-time systems;Navigation;Planning","collision avoidance;decentralised control;learning (artificial intelligence);mobile robots;multi-robot systems;robot kinematics","decentralized noncommunicating multiagent collision avoidance;deep reinforcement learning;collision-free paths;multiagent systems;online computation;interaction pattern prediction;offline learning procedure;agent joint configuration;agent positions;agent velocities;collision-free velocity vector;agent motion uncertainty;path quality improvement","","269","","26","IEEE","24 Jul 2017","","","IEEE","IEEE Conferences"
"Overcoming Exploration in Reinforcement Learning with Demonstrations","A. Nair; B. McGrew; M. Andrychowicz; W. Zaremba; P. Abbeel","University of California, Berkeley; OpenAI; OpenAI; OpenAI; University of California, Berkeley","2018 IEEE International Conference on Robotics and Automation (ICRA)","13 Sep 2018","2018","","","6292","6299","Exploration in environments with sparse rewards has been a persistent problem in reinforcement learning (RL). Many tasks are natural to specify with a sparse reward, and manually shaping a reward function can result in suboptimal performance. However, finding a non-zero reward is exponentially more difficult with increasing task horizon or action dimensionality. This puts many real-world tasks out of practical reach of RL methods. In this work, we use demonstrations to overcome the exploration problem and successfully learn to perform long-horizon, multi-step robotics tasks with continuous control such as stacking blocks with a robot arm. Our method, which builds on top of Deep Deterministic Policy Gradients and Hindsight Experience Replay, provides an order of magnitude of speedup over RL on simulated robotics tasks. It is simple to implement and makes only the additional assumption that we can collect a small set of demonstrations. Furthermore, our method is able to solve tasks not solvable by either RL or behavior cloning alone, and often ends up outperforming the demonstrator policy.","2577-087X","978-1-5386-3081-5","10.1109/ICRA.2018.8463162","","https://ieeexplore.ieee.org/stamp/stamp.jsp?arnumber=8463162","","Task analysis;Robots;Learning (artificial intelligence);Stacking;Training;Mathematical model;Games","control engineering computing;learning (artificial intelligence);manipulators","reinforcement learning;reward function;task horizon;RL methods;exploration problem;multistep robotics tasks;robot arm;deep deterministic policy gradients;hindsight experience replay;simulated robotics tasks","","236","","40","IEEE","13 Sep 2018","","","IEEE","IEEE Conferences"
"Crowd-Robot Interaction: Crowd-Aware Robot Navigation With Attention-Based Deep Reinforcement Learning","C. Chen; Y. Liu; S. Kreiss; A. Alahi","VITA, Ecole Polytechnique Federal de Lausanne, EPFL, Switzerland; VITA, Ecole Polytechnique Federal de Lausanne, EPFL, Switzerland; VITA, Ecole Polytechnique Federal de Lausanne, EPFL, Switzerland; VITA, Ecole Polytechnique Federal de Lausanne, EPFL, Switzerland","2019 International Conference on Robotics and Automation (ICRA)","12 Aug 2019","2019","","","6015","6022","Mobility in an effective and socially-compliant manner is an essential yet challenging task for robots operating in crowded spaces. Recent works have shown the power of deep reinforcement learning techniques to learn socially cooperative policies. However, their cooperation ability deteriorates as the crowd grows since they typically relax the problem as a one-way Human-Robot interaction problem. In this work, we want to go beyond first-order Human-Robot interaction and more explicitly model Crowd-Robot Interaction (CRI). We propose to (i) rethink pairwise interactions with a self-attention mechanism, and (ii) jointly model Human-Robot as well as Human-Human interactions in the deep reinforcement learning framework. Our model captures the Human-Human interactions occurring in dense crowds that indirectly affects the robot's anticipation capability. Our proposed attentive pooling mechanism learns the collective importance of neighboring humans with respect to their future states. Various experiments demonstrate that our model can anticipate human dynamics and navigate in crowds with time efficiency, outperforming state-of-the-art methods.","2577-087X","978-1-5386-6027-0","10.1109/ICRA.2019.8794134","","https://ieeexplore.ieee.org/stamp/stamp.jsp?arnumber=8794134","","Robots;Navigation;Reinforcement learning;Planning;Task analysis;Human-robot interaction;Biological system modeling","human-robot interaction;learning (artificial intelligence);mobile robots;neural nets;pedestrians","crowded spaces;Human-Human interactions;deep reinforcement learning framework;dense crowds;human dynamics;crowd-aware robot navigation;attention-based deep reinforcement learning;robot operations;crowd-robot interaction","","214","","52","IEEE","12 Aug 2019","","","IEEE","IEEE Conferences"
"Towards Optimally Decentralized Multi-Robot Collision Avoidance via Deep Reinforcement Learning","P. Long; T. Fan; X. Liao; W. Liu; H. Zhang; J. Pan","Dorabot Inc., Shenzhen, China; Dorabot Inc., Shenzhen, China; Dorabot Inc., Shenzhen, China; Department of Computer Science, Fuzhou University, Fuzhou, China; Dorabot Inc., Shenzhen, China; Department of Mechanical and Biomedical Engineering, City University of Hong Kong, Hong Kong, China","2018 IEEE International Conference on Robotics and Automation (ICRA)","13 Sep 2018","2018","","","6252","6259","Developing a safe and efficient collision avoidance policy for multiple robots is challenging in the decentralized scenarios where each robot generates its paths without observing other robots' states and intents. While other distributed multi-robot collision avoidance systems exist, they often require extracting agent-level features to plan a local collision-free action, which can be computationally prohibitive and not robust. More importantly, in practice the performance of these methods are much lower than their centralized counterparts. We present a decentralized sensor-level collision avoidance policy for multi-robot systems, which directly maps raw sensor measurements to an agent's steering commands in terms of movement velocity. As a first step toward reducing the performance gap between decentralized and centralized methods, we present a multi-scenario multi-stage training framework to learn an optimal policy. The policy is trained over a large number of robots on rich, complex environments simultaneously using a policy gradient based reinforcement learning algorithm. We validate the learned sensor-level collision avoidance policy in a variety of simulated scenarios with thorough performance evaluations and show that the final learned policy is able to find time efficient, collision-free paths for a large-scale robot system. We also demonstrate that the learned policy can be well generalized to new scenarios that do not appear in the entire training period, including navigating a heterogeneous group of robots and a large-scale scenario with 100 robots. Videos are available at https://sites.google.com/view/drlmaca.","2577-087X","978-1-5386-3081-5","10.1109/ICRA.2018.8461113","","https://ieeexplore.ieee.org/stamp/stamp.jsp?arnumber=8461113","","Collision avoidance;Robot sensing systems;Robot kinematics;Navigation;Robustness;Training","collision avoidance;decentralised control;gradient methods;learning (artificial intelligence);mobile robots;multi-robot systems","multiscenario multistage training framework;optimal policy;policy gradient;reinforcement learning algorithm;learned sensor-level collision avoidance policy;final learned policy;collision-free paths;large-scale robot system;deep reinforcement learning;safe collision avoidance policy;efficient collision avoidance policy;optimally decentralized multirobot collision avoidance;agent-level feature extraction;decentralized methods;maps raw sensor measurements;multirobot systems;decentralized sensor-level collision avoidance policy;local collision-free action;distributed multirobot collision avoidance systems","","213","","27","IEEE","13 Sep 2018","","","IEEE","IEEE Conferences"
