"Open Loop Position Control of Soft Continuum Arm Using Deep Reinforcement Learning","S. Satheeshbabu; N. K. Uppalapati; G. Chowdhary; G. Krishnan","Industrial and Systems Engineering Department, University of Illinois at Urbana-Champaign, 104 S Mathews Ave, Urbana; Industrial and Systems Engineering Department, University of Illinois at Urbana-Champaign, 104 S Mathews Ave, Urbana; Department of Agricultural and Biological Engineering and the Coordinated Science Lab (CSL), University of Illinois at Urbana-Champaign, Pennsylvania Urbana, Illinois; Industrial and Systems Engineering Department, University of Illinois at Urbana-Champaign, 104 S Mathews Ave, Urbana, IL","2019 International Conference on Robotics and Automation (ICRA)","12 Aug 2019","2019","","","5133","5139","Soft robots undergo large nonlinear spatial deformations due to both inherent actuation and external loading. The physics underlying these deformations is complex, and often requires intricate analytical and numerical models. The complexity of these models may render traditional model-based control difficult and unsuitable. Model-free methods offer an alternative for analyzing the behavior of such complex systems without the need for elaborate modeling techniques. In this paper, we present a model-free approach for open loop position control of a soft spatial continuum arm, based on deep reinforcement learning. The continuum arm is pneumatically actuated and attains a spatial work-space by a combination of unidirectional bending and bidirectional torsional deformation. We use Deep-Q Learning with experience replay to train the system in simulation. The efficacy and robustness of the control policy obtained from the system is validated both in simulation and on the continuum arm prototype for varying external loading conditions.","2577-087X","978-1-5386-6027-0","10.1109/ICRA.2019.8793653","","https://ieeexplore.ieee.org/stamp/stamp.jsp?arnumber=8793653","","Manipulators;Load modeling;Mathematical model;Numerical models;Strain","bending;control engineering computing;learning (artificial intelligence);manipulator dynamics;neural nets;numerical analysis;pneumatic actuators;position control;torsion","open loop position control;deep reinforcement learning;soft robots;nonlinear spatial deformations;inherent actuation;numerical models;soft spatial continuum arm;unidirectional bending deformation;bidirectional torsional deformation;Deep-Q Learning;continuum arm prototype;external loading conditions","","42","","34","IEEE","12 Aug 2019","","","IEEE","IEEE Conferences"
"Deep reinforcement learning for tensegrity robot locomotion","M. Zhang; X. Geng; J. Bruce; K. Caluwaerts; M. Vespignani; V. SunSpiral; P. Abbeel; S. Levine","Department of Electrical Engineering and Computer Sciences, University of California, Berkeley, CA; Department of Electrical Engineering and Computer Sciences, University of California, Berkeley, CA; Department of Computer Engineering, University of California, Santa Cruz, CA; Autodesk, Inc., San Francisco, CA; Nasa Ames Research Center, Moffett Field, CA; Nasa Ames Research Center, Moffett Field, CA; OpenAI, San Francisco, CA; Department of Electrical Engineering and Computer Sciences, University of California, Berkeley, CA","2017 IEEE International Conference on Robotics and Automation (ICRA)","24 Jul 2017","2017","","","634","641","Tensegrity robots, composed of rigid rods connected by elastic cables, have a number of unique properties that make them appealing for use as planetary exploration rovers. However, control of tensegrity robots remains a difficult problem due to their unusual structures and complex dynamics. In this work, we show how locomotion gaits can be learned automatically using a novel extension of mirror descent guided policy search (MDGPS) applied to periodic locomotion movements, and we demonstrate the effectiveness of our approach on tensegrity robot locomotion. We evaluate our method with real-world and simulated experiments on the SUPERball tensegrity robot, showing that the learned policies generalize to changes in system parameters, unreliable sensor measurements, and variation in environmental conditions, including varied terrains and a range of different gravities. Our experiments demonstrate that our method not only learns fast, power-efficient feedback policies for rolling gaits, but that these policies can succeed with only the limited onboard sensing provided by SUPERball's accelerometers. We compare the learned feedback policies to learned open-loop policies and hand-engineered controllers, and demonstrate that the learned policy enables the first continuous, reliable locomotion gait for the real SUPERball robot. Our code and supplementary material is available from http://rll.berkeley.edu/drl_tensegrity.","","978-1-5090-4633-1","10.1109/ICRA.2017.7989079","","https://ieeexplore.ieee.org/stamp/stamp.jsp?arnumber=7989079","","Robot sensing systems;Mirrors;Neural networks;Training;Gravity;Robustness","learning (artificial intelligence);mobile robots;planetary rovers","deep reinforcement learning;tensegrity robot locomotion;rigid rods;elastic cables;planetary exploration rovers;complex dynamics;locomotion gaits;mirror descent guided policy search;MDGPS;periodic locomotion movements;SUPERball tensegrity robot;unreliable sensor measurements;power-efficient feedback policies;rolling gaits;onboard sensing;SUPERball accelerometers;open-loop policies;hand-engineered controllers;reliable locomotion gait;SUPERball robot","","41","1","38","IEEE","24 Jul 2017","","","IEEE","IEEE Conferences"
"Distributed reinforcement learning for power limited many-core system performance optimization","Z. Chen; D. Marculescu","Electrical and Computer Engineering, Carnegie Mellon University; Electrical and Computer Engineering, Carnegie Mellon University","2015 Design, Automation & Test in Europe Conference & Exhibition (DATE)","23 Apr 2015","2015","","","1521","1526","As power density emerges as the main constraint for many-core systems, controlling power consumption under the Thermal Design Power (TDP) while maximizing the performance becomes increasingly critical. To dynamically save power, Dynamic Voltage Frequency Scaling (DVFS) techniques have proved to be effective and are widely available commercially. In this paper, we present an On-line Distributed Reinforcement Learning (OD-RL) based DVFS control algorithm for many-core system performance improvement under power constraints. At the finer grain, a per-core Reinforcement Learning (RL) method is used to learn the optimal control policy of the Voltage/Frequency (VF) levels in a system model-free manner. At the coarser grain, an efficient global power budget reallocation algorithm is used to maximize the overall performance. The experiments show that compared to the state-of-the-art algorithms: 1) OD-RL produces up to 98% less budget overshoot, 2) up to 44.3x better throughput per over-the-budget energy and up to 23% higher energy efficiency, and 3) two orders of magnitude speedup over state-of-the-art techniques for systems with hundreds of cores.","1558-1101","978-3-9815-3705-5","","","https://ieeexplore.ieee.org/stamp/stamp.jsp?arnumber=7092630","","Power demand;Algorithm design and analysis;Multicore processing;Learning (artificial intelligence);Throughput;Scalability;Complexity theory","electronic engineering computing;learning (artificial intelligence);multiprocessing systems;optimal control;performance evaluation;power aware computing;resource allocation","distributed reinforcement learning;power limited many-core system performance optimization;power consumption;thermal design power;TDP;dynamic voltage frequency scaling techniques;DVFS techniques;online distributed reinforcement learning based DVFS control algorithm;OD-RL based DVFS control algorithm;many-core system performance improvement;per-core reinforcement learning method;optimal control policy;global power budget reallocation algorithm;energy efficiency","","41","","25","","23 Apr 2015","","","IEEE","IEEE Conferences"
"A friction-model-based framework for Reinforcement Learning of robotic tasks in non-rigid environments","A. Colomé; A. Planells; C. Torras","Institut de Robòtica i Informàtica Industrial (UPC-CSIC), Barcelona, Spain; Institut de Robòtica i Informàtica Industrial (UPC-CSIC), Barcelona, Spain; Institut de Robòtica i Informàtica Industrial (UPC-CSIC), Barcelona, Spain","2015 IEEE International Conference on Robotics and Automation (ICRA)","2 Jul 2015","2015","","","5649","5654","Learning motion tasks in a real environment with deformable objects requires not only a Reinforcement Learning (RL) algorithm, but also a good motion characterization, a preferably compliant robot controller, and an agent giving feedback for the rewards/costs in the RL algorithm. In this paper, we unify all these parts in a simple but effective way to properly learn safety-critical robotic tasks such as wrapping a scarf around the neck (so far, of a mannequin).","1050-4729","978-1-4799-6923-4","10.1109/ICRA.2015.7139990","","https://ieeexplore.ieee.org/stamp/stamp.jsp?arnumber=7139990","","Robots;Friction;Joints;Trajectory;Torque;Acceleration;Dynamics","friction;human-robot interaction;learning (artificial intelligence);motion control;robot dynamics","friction-model-based framework;reinforcement learning;robotic tasks;nonrigid environments;motion task learning;deformable objects;motion characterization;compliant robot controller;RL algorithm;safety-critical robotic tasks;compliant controller;inverse dynamic model;IDM;friction hystheresis;Barrett WAM;robot joints;friction-aware controller;dynamic movement primitives;DMP;visual-force feedback;RL algorithm","","38","","14","IEEE","2 Jul 2015","","","IEEE","IEEE Conferences"
"DRiLLS: Deep Reinforcement Learning for Logic Synthesis","A. Hosny; S. Hashemi; M. Shalan; S. Reda","Computer Science Dept, Brown University Providence, RI; School of Engineering, Brown University Providence, RI; Computer Science Dept, American University in Cairo, Cairo, Egypt; School of Engineering, Brown University Providence, RI","2020 25th Asia and South Pacific Design Automation Conference (ASP-DAC)","26 Mar 2020","2020","","","581","586","Logic synthesis requires extensive tuning of the synthesis optimization flow where the quality of results (QoR) depends on the sequence of optimizations used. Efficient design space exploration is challenging due to the exponential number of possible optimization permutations. Therefore, automating the optimization process is necessary. In this work, we propose a novel reinforcement learning-based methodology that navigates the optimization space without human intervention. We demonstrate the training of an Advantage Actor Critic (A2C) agent that seeks to minimize area subject to a timing constraint. Using the proposed methodology, designs can be optimized autonomously with no-humans in-loop. Evaluation on the comprehensive EPFL benchmark suite shows that the agent outperforms existing exploration methodologies and improves QoRs by an average of 13%.","2153-697X","978-1-7281-4123-7","10.1109/ASP-DAC47756.2020.9045559","","https://ieeexplore.ieee.org/stamp/stamp.jsp?arnumber=9045559","","Reinforcement learning;Benchmark testing;Space exploration;Delays;Circuit synthesis;Optimization;Tuning","learning (artificial intelligence);logic design","DRiLLS;deep reinforcement learning;logic synthesis;QoR;design space exploration;exponential number;optimization process;reinforcement learning-based methodology;advantage actor critic agent;EPFL benchmark suit;A2C agent;timing constraint;quality of results","","36","","20","IEEE","26 Mar 2020","","","IEEE","IEEE Conferences"
"Autonomous drifting using simulation-aided reinforcement learning","M. Cutler; J. P. How","Laboratory of Information and Decision Systems, Massachusetts Institute of Technology, Cambridge, MA, USA; Laboratory of Information and Decision Systems, Massachusetts Institute of Technology, Cambridge, MA, USA","2016 IEEE International Conference on Robotics and Automation (ICRA)","9 Jun 2016","2016","","","5442","5448","We introduce a framework that combines simple and complex continuous state-action simulators with a real-world robot to efficiently find good control policies, while minimizing the number of samples needed from the physical robot. The framework combines the strengths of various simulation levels by first finding optimal policies in a simple model, and then using that solution to initialize a gradient-based learner in a more complex simulation. The policy and transition dynamics from the complex simulation are in turn used to guide the learning in the physical world. A method is developed for transferring information gathered in the physical world back to the learning agent in the simulation. The new information is used to re-evaluate whether the original simulated policy is still optimal given the updated knowledge from the real-world. This reverse transfer is critical to minimizing samples from the physical world. The new framework is demonstrated on a robotic car learning to perform controlled drifting maneuvers. A video of the car's performance can be found at https: //youtu.be/opsmd5yuBF0.","","978-1-4673-8026-3","10.1109/ICRA.2016.7487756","","https://ieeexplore.ieee.org/stamp/stamp.jsp?arnumber=7487756","","Computational modeling;Mathematical model;Optimal control;Robots;Data models;Heuristic algorithms;Approximation algorithms","learning (artificial intelligence);robots","autonomous drifting;simulation-aided reinforcement learning;continuous state-action simulators;real-world robot;control policies;gradient-based learner;information transfer;robotic car learning;controlled drifting maneuvers","","36","","18","IEEE","9 Jun 2016","","","IEEE","IEEE Conferences"
"Risk Averse Robust Adversarial Reinforcement Learning","X. Pan; D. Seita; Y. Gao; J. Canny","University of California, Berkeley; University of California, Berkeley; University of California, Berkeley; University of California, Berkeley","2019 International Conference on Robotics and Automation (ICRA)","12 Aug 2019","2019","","","8522","8528","Deep reinforcement learning has recently made significant progress in solving computer games and robotic control tasks. A known problem, though, is that policies overfit to the training environment and may not avoid rare, catastrophic events such as automotive accidents. A classical technique for improving the robustness of reinforcement learning algorithms is to train on a set of randomized environments, but this approach only guards against common situations. Recently, robust adversarial reinforcement learning (RARL) was developed, which allows efficient applications of random and systematic perturbations by a trained adversary. A limitation of RARL is that only the expected control objective is optimized; there is no explicit modeling or optimization of risk. Thus the agents do not consider the probability of catastrophic events (i.e., those inducing abnormally large negative reward), except through their effect on the expected objective. In this paper we introduce risk-averse robust adversarial reinforcement learning (RARARL), using a risk-averse protagonist and a risk-seeking adversary. We test our approach on a self-driving vehicle controller. We use an ensemble of policy networks to model risk as the variance of value functions. We show through experiments that a risk-averse agent is better equipped to handle a risk-seeking adversary, and experiences substantially fewer crashes compared to agents trained without an adversary. Supplementary materials are available at https://sites.google.com/view/rararl.","2577-087X","978-1-5386-6027-0","10.1109/ICRA.2019.8794293","","https://ieeexplore.ieee.org/stamp/stamp.jsp?arnumber=8794293","","Reinforcement learning;Training;Mathematical model;Robustness;Autonomous vehicles;Task analysis;Accidents","learning (artificial intelligence);optimisation;probability","risk averse robust adversarial reinforcement learning;deep reinforcement learning;computer games;robotic control;automotive accidents;optimization;probability;RARARL;self-driving vehicle controller","","34","","41","IEEE","12 Aug 2019","","","IEEE","IEEE Conferences"
"Reinforcement learning with multi-fidelity simulators","M. Cutler; T. J. Walsh; J. P. How","Laboratory of Information and Decision Systems, Massachusetts Institute of Technology, Cambridge, MA, USA; Laboratory of Information and Decision Systems, Massachusetts Institute of Technology, Cambridge, MA, USA; Laboratory of Information and Decision Systems, Massachusetts Institute of Technology, Cambridge, MA, USA","2014 IEEE International Conference on Robotics and Automation (ICRA)","29 Sep 2014","2014","","","3888","3895","We present a framework for reinforcement learning (RL) in a scenario where multiple simulators are available with decreasing amounts of fidelity to the real-world learning scenario. Our framework is designed to limit the number of samples used in each successively higher-fidelity/cost simulator by allowing the agent to choose to run trajectories at the lowest level that will still provide it with information. The approach transfers state-action Q-values from lower-fidelity models as heuristics for the “Knows What It Knows” family of RL algorithms, which is applicable over a wide range of possible dynamics and reward representations. Theoretical proofs of the framework's sample complexity are given and empirical results are demonstrated on a remote controlled car with multiple simulators. The approach allows RL algorithms to find near-optimal policies for the real world with fewer expensive real-world samples than previous transfer approaches or learning without simulators.","1050-4729","978-1-4799-3685-4","10.1109/ICRA.2014.6907423","","https://ieeexplore.ieee.org/stamp/stamp.jsp?arnumber=6907423","","Heuristic algorithms;Complexity theory;Learning (artificial intelligence);Polynomials;Optimization;Data models;Silicon","automobiles;control engineering computing;learning (artificial intelligence);mobile robots;telerobotics;trajectory control","reinforcement learning;RL algorithms;multifidelity simulators;state-action Q-values;remote controlled car;robotic control algorithm;trajectory level","","32","1","18","IEEE","29 Sep 2014","","","IEEE","IEEE Conferences"
"Deep Reinforcement Learning of Navigation in a Complex and Crowded Environment with a Limited Field of View","J. Choi; K. Park; M. Kim; S. Seok","NAVER LABS, Gyeonggi-do, South Korea; NAVER LABS, Gyeonggi-do, South Korea; NAVER LABS, Gyeonggi-do, South Korea; NAVER LABS, Gyeonggi-do, South Korea","2019 International Conference on Robotics and Automation (ICRA)","12 Aug 2019","2019","","","5993","6000","Mobile robots are required to navigate freely in a complex and crowded environment in order to provide services to humans. For this navigation ability, deep reinforcement learning (DRL)-based methods are gaining increasing attentions. However, existing DRL methods require a wide field of view (FOV), which imposes the usage of high-cost lidar devices. In this paper, we explore the possibility of replacing expensive lidar devices with affordable depth cameras which have a limited FOV. First, we analyze the effect of a limited field of view in the DRL agents. Second, we propose a LSTM agent with Local-Map Critic (LSTM-LMC), which is a novel DRL method to learn efficient navigation in a complex environment with a limited FOV. Lastly, we introduce the dynamics randomization technique to improve the robustness of the DRL agents in the real world. We found that our method with a limited FOV can outperform the methods having a wide FOV but limited memory. We provide the empirical evidence that our method learns to implicitly model the surrounding environment and dynamics of other agents. We also show that a robot with a single depth camera can navigate through a complex real-world environment using our method.","2577-087X","978-1-5386-6027-0","10.1109/ICRA.2019.8793979","","https://ieeexplore.ieee.org/stamp/stamp.jsp?arnumber=8793979","","Navigation;Mobile robots;Reinforcement learning;Laser radar;Robot sensing systems;Cameras","cameras;learning (artificial intelligence);mobile robots;navigation;neural nets;optical radar;path planning;robot vision","deep reinforcement learning-based methods;DRL agents;LSTM agent;Local-Map Critic;LSTM-LMC;wide FOV;single depth camera;mobile robots;lidar devices;DRL method;depth cameras;dynamics randomization technique","","31","","36","IEEE","12 Aug 2019","","","IEEE","IEEE Conferences"
"A deep reinforcement learning framework for optimizing fuel economy of hybrid electric vehicles","P. Zhao; Y. Wang; N. Chang; Q. Zhu; X. Lin","Department of ECE, Northeastern University, Boston, MA, USA; Department of EECS, Syracuse University, Syracuse, NY, USA; School of EE, Korea Advanced Institute of Science and Engineering, Daejeon, Korea; Department of EECS, Northwestern University, Evanston, IL, USA; Department of ECE, Northeastern University, Boston, MA, USA","2018 23rd Asia and South Pacific Design Automation Conference (ASP-DAC)","22 Feb 2018","2018","","","196","202","Hybrid electric vehicles employ a hybrid propulsion system to combine the energy efficiency of electric motor and a long driving range of internal combustion engine, thereby achieving a higher fuel economy as well as convenience compared with conventional ICE vehicles. However, the relatively complicated powertrain structures of HEVs necessitate an effective power management policy to determine the power split between ICE and EM. In this work, we propose a deep reinforcement learning framework of the HEV power management with the aim of improving fuel economy. The DRL technique is comprised of an offline deep neural network construction phase and an online deep Q-learning phase. Unlike traditional reinforcement learning, DRL presents the capability of handling the high dimensional state and action space in the actual decision-making process, making it suitable for the HEV power management problem. Enabled by the DRL technique, the derived HEV power management policy is close to optimal, fully model-free, and independent of a prior knowledge of driving cycles. Simulation results based on actual vehicle setup over real-world and testing driving cycles demonstrate the effectiveness of the proposed framework on optimizing HEV fuel economy.","2153-697X","978-1-5090-0602-1","10.1109/ASPDAC.2018.8297305","","https://ieeexplore.ieee.org/stamp/stamp.jsp?arnumber=8297305","","Hybrid electric vehicles;Ice;Power system management;Propulsion;Fuel economy;Batteries;Torque","electric motors;electric propulsion;energy management systems;fuel economy;hybrid electric vehicles;learning (artificial intelligence);neural nets;optimisation;power engineering computing","deep reinforcement learning framework;hybrid electric vehicles;hybrid propulsion system;energy efficiency;electric motor;long driving range;internal combustion engine;higher fuel economy;conventional ICE vehicles;effective power management policy;power split;DRL technique;offline deep neural network construction phase;online deep Q-learning phase;high dimensional state;HEV power management problem;actual vehicle setup;HEV power management policy;HEV fuel economy optimization","","26","","31","IEEE","22 Feb 2018","","","IEEE","IEEE Conferences"
"Rearrangement with Nonprehensile Manipulation Using Deep Reinforcement Learning","W. Yuan; J. A. Stork; D. Kragic; M. Y. Wang; K. Hang","Hong Kong University of Science and Technology, HKUST Robotics Institute; Robotics, Perception and Learning Lab, KTH Royal Institute of Technology, Sweden; Department of Electronic and Computer Engineering; Hong Kong University of Science and Technology, HKUST Robotics Institute; Hong Kong University of Science and Technology, HKUST Robotics Institute","2018 IEEE International Conference on Robotics and Automation (ICRA)","13 Sep 2018","2018","","","270","277","Rearranging objects on a tabletop surface by means of nonprehensile manipulation is a task which requires skillful interaction with the physical world. Usually, this is achieved by precisely modeling physical properties of the objects, robot, and the environment for explicit planning. In contrast, as explicitly modeling the physical environment is not always feasible and involves various uncertainties, we learn a nonprehensile rearrangement strategy with deep reinforcement learning based on only visual feedback. For this, we model the task with rewards and train a deep Q-network. Our potential field-based heuristic exploration strategy reduces the amount of collisions which lead to suboptimal outcomes and we actively balance the training set to avoid bias towards poor examples. Our training process leads to quicker learning and better performance on the task as compared to uniform exploration and standard experience replay. We demonstrate empirical evidence from simulation that our method leads to a success rate of 85%, show that our system can cope with sudden changes of the environment, and compare our performance with human level performance.","2577-087X","978-1-5386-3081-5","10.1109/ICRA.2018.8462863","","https://ieeexplore.ieee.org/stamp/stamp.jsp?arnumber=8462863","","Planning;Task analysis;Robots;Tools;Cameras;Visualization;Training","learning (artificial intelligence);manipulators;mobile robots;path planning","potential field-based heuristic exploration strategy;deep Q-network;nonprehensile rearrangement strategy;physical environment;physical world;skillful interaction;tabletop surface;rearranging objects;deep reinforcement learning;nonprehensile manipulation;quicker learning;training process","","26","","34","IEEE","13 Sep 2018","","","IEEE","IEEE Conferences"
