"PRIMAL$_2$: Pathfinding Via Reinforcement and Imitation Multi-Agent Learning - Lifelong","M. Damani; Z. Luo; E. Wenzel; G. Sartoretti","Department of Mechanical Engineering, National University of Singapore, Singapore; Department of Mechanical Engineering, National University of Singapore, Singapore; Department of Mechanical Engineering, National University of Singapore, Singapore; Department of Mechanical Engineering, National University of Singapore, Singapore","IEEE Robotics and Automation Letters","18 Mar 2021","2021","6","2","2666","2673","Multi-agent path finding (MAPF) is an indispensable component of large-scale robot deployments in numerous domains ranging from airport management to warehouse automation. In particular, this work addresses lifelong MAPF (LMAPF) - an online variant of the problem where agents are immediately assigned a new goal upon reaching their current one - in dense and highly structured environments, typical of real-world warehouse operations. Effectively solving LMAPF in such environments requires expensive coordination between agents as well as frequent replanning abilities, a daunting task for existing coupled and decoupled approaches alike. With the purpose of achieving considerable agent coordination without any compromise on reactivity and scalability, we introduce PRIMAL2, a distributed reinforcement learning framework for LMAPF where agents learn fully decentralized policies to reactively plan paths online in a partially observable world. We extend our previous work, which was effective in low-density sparsely occupied worlds, to highly structured and constrained worlds by identifying behaviors and conventions which improve implicit agent coordination, and enable their learning through the construction of a novel local agent observation and various training aids. We present extensive results of PRIMAL2 in both MAPF and LMAPF environments and compare its performance to state-of-the-art planners in terms of makespan and throughput. We show that PRIMAL2 significantly surpasses our previous work and performs comparably to these baselines, while allowing real-time re-planning and scaling up to 2048 agents.","2377-3766","","10.1109/LRA.2021.3062803","","https://ieeexplore.ieee.org/stamp/stamp.jsp?arnumber=9366340","Deep learning in robotics and automation;distributed robot systems;multi-robot systems","Robots;Robot kinematics;Task analysis;Planning;Scalability;Reinforcement learning;Training","learning (artificial intelligence);multi-agent systems;multi-robot systems;path planning;planning (artificial intelligence);warehouse automation","local agent observation;implicit agent coordination;highly structured constrained worlds;partially observable world;distributed reinforcement learning framework;reactivity;considerable agent coordination;frequent replanning abilities;expensive coordination;real-world warehouse operations;highly structured environments;dense environments;online variant;lifelong MAPF;warehouse automation;airport management;numerous domains;large-scale robot deployments;multiagent path finding;imitation multiagent learning;pathfinding via reinforcement;LMAPF environments;PRIMAL","","37","","31","IEEE","1 Mar 2021","","","IEEE","IEEE Journals"
"Deep-Reinforcement-Learning-Based Path Planning for Industrial Robots Using Distance Sensors as Observation","T. Bhuiyan; L. Kästner; Y. Hu; B. Kutschank; J. Lambrecht","Chair Industry Grade Networks and Clouds, Faculty of Electrical Engineering, and Computer Science, Berlin Institute of Technology, Berlin, Germany; Chair Industry Grade Networks and Clouds, Faculty of Electrical Engineering, and Computer Science, Berlin Institute of Technology, Berlin, Germany; Chair Industry Grade Networks and Clouds, Faculty of Electrical Engineering, and Computer Science, Berlin Institute of Technology, Berlin, Germany; Chair Industry Grade Networks and Clouds, Faculty of Electrical Engineering, and Computer Science, Berlin Institute of Technology, Berlin, Germany; Chair Industry Grade Networks and Clouds, Faculty of Electrical Engineering, and Computer Science, Berlin Institute of Technology, Berlin, Germany","2023 8th International Conference on Control and Robotics Engineering (ICCRE)","26 Jun 2023","2023","","","204","210","Traditionally, collision-free path planning for industrial robots is realized by sampling-based algorithms such as RRT (Rapidly-exploring Random Tree), PRM (Probabilistic Roadmap), etc. Sampling-based algorithms require long computation times, especially in complex environments. Furthermore, the environment in which they are employed needs to be known beforehand. When utilizing these approaches in new environments, a tedious engineering effort in setting hyperparameters needs to be conducted, which is time- and cost-intensive. On the other hand, DRL (Deep Reinforcement Learning) has shown remarkable results in dealing with complex environments, generalizing new problem instances, and solving motion planning problems efficiently. On that account, this paper proposes a Deep-Reinforcement-Learning-based motion planner for robotic manipulators. We propose an easily reproducible method to train an agent in randomized scenarios achieving generalization for unknown environments. We evaluated our model against state-of-the-art sampling- and DRL-based planners in several experiments containing static and dynamic obstacles. Results show the adaptability of our agent in new environments and the superiority in terms of path length and execution time compared to conventional methods. Our code is available on GitHub [1].","2835-3722","979-8-3503-4565-0","10.1109/ICCRE57112.2023.10155608","","https://ieeexplore.ieee.org/stamp/stamp.jsp?arnumber=10155608","Deep Reinforcement Learning;Path Planning;Industrial Robots;Automation","Adaptation models;Stars;Reinforcement learning;Industrial robots;Probabilistic logic;Planning;Trajectory","collision avoidance;deep learning (artificial intelligence);industrial robots;learning (artificial intelligence);manipulators;mobile robots;path planning;reinforcement learning;trees (mathematics)","collision-free path;complex environments;Deep Reinforcement;Deep-Reinforcement-Learning-based motion planner;Deep-Reinforcement-Learning-based path planning;distance sensors;DRL-based planners;execution time;industrial robots;long computation times;motion planning problems;path length;Probabilistic Roadmap;randomized scenarios;Rapidly-exploring Random Tree;robotic manipulators;sampling-based algorithms;state-of-the-art sampling;tedious engineering effort","","1","","30","IEEE","26 Jun 2023","","","IEEE","IEEE Conferences"
"Automatic Generation Control with Competing GENCOs-A Reinforcement Learning Based Approach","D. Jay; K. S. Swarup","Department of Electrical Engineering, Indian Institute Of Technology, Chennai; Department of Electrical Engineering, Indian Institute Of Technology, Chennai","2018 20th National Power Systems Conference (NPSC)","25 Jul 2019","2018","","","1","5","Under deregulation, Automatic Generation Control (AGC) scheme may consider economic dispatch of Generating Companies (GENCOs) as well in addition to minimising the system frequency deviation. This will result in increased participation from GENCOs in AGC. GENCOs being private utilities, will have the private information like cost function etc which will not be shared with the system operator. This imposes a challenge on implementing classical economic dispatch problem in AGC scheme. The contribution of the paper is a game theoretic based model of AGC scheme that will ensure an optimal dispatch to competing GENCOs. This is achieved by defining an optimal participation factor for GENCOs that will minimize their cost of production. A game theoretic approach towards AGC as a dynamic game is presented and GENCOs are considered as Reinforcement learning agents. A Single Agent Q-Learning method along with pursuit algorithm is used at each GENCO agent to achieve the equilibrium point in AGC. The algorithm was studied with three competing GENCOs. Results show the suitability of the proposed AGC model and its ability to minimize the deviation in system frequency while ensuring economic operation of the system.","","978-1-5386-6159-8","10.1109/NPSC.2018.8771789","","https://ieeexplore.ieee.org/stamp/stamp.jsp?arnumber=8771789","Automatic Generation Control;Economic Dispatch;Deregulation;Stochasticcollaborationgames;Nash Equilibrium;Reinforcement Q-Learning;PursuitAlgorithm","","electricity supply industry;game theory;learning (artificial intelligence);multi-agent systems;optimisation;power engineering computing;power generation control;power generation dispatch;power generation economics","generating companies;optimal economic dispatch problem;reinforcement learning agents;automatic generation control scheme;private utilities;pursuit algorithm;single agent Q-learning method;production cost minimization;GENCO agent;game theoretic approach;optimal participation factor;AGC scheme;system frequency deviation","","","","10","IEEE","25 Jul 2019","","","IEEE","IEEE Conferences"
"Path Planning Algorithms for USVs via Deep Reinforcement Learning","H. Zhai; W. Wang; W. Zhang; Q. Li","School of Automation Science and Electrical Engineering, Beihang University, Beijing, China; School of Automation Science and Electrical Engineering, Beihang University, Beijing, China; School of Automation Science and Electrical Engineering, Beihang University, Beijing, China; School of Automation Science and Electrical Engineering, Beihang University, Beijing, China","2021 China Automation Congress (CAC)","14 Mar 2022","2021","","","4281","4286","With the application of Unmanned Surface Vehicles (USVs) in complex and changeable environments, therefore it is particularly significant to enhance its autonomous navigation ability. Deep reinforcement learning (DRL) is a emerging method that combines the perception ability of deep learning (DL) with the decision-making ability of reinforcement learning (RL). Since it was put forward, DRL has achieved remarkable results in theory and application. In addition, DRL has the ability of perception and decision-making simultaneously, and shows strong learning ability. Therefore, DRL algorithms can be applied to solve the path planning problem of USV. In this paper, pointing at solving the path planning problem of USV, the horizontal 3-DOF motion model of USV is established, and the DQN algorithm is applied to settle USV path planning problem. Finally, the above algorithm is verified on the simulation platform.","2688-0938","978-1-6654-2647-3","10.1109/CAC53003.2021.9728038","","https://ieeexplore.ieee.org/stamp/stamp.jsp?arnumber=9728038","path planning;unmanned surface vehicle;obstacle avoidance;deep reinforcement learning","Deep learning;Automation;Decision making;Reinforcement learning;Path planning;Autonomous robots","decision making;deep learning (artificial intelligence);mobile robots;path planning;reinforcement learning;remotely operated vehicles","decision-making ability;strong learning ability;DRL algorithms;DQN algorithm;USV path planning problem;path planning algorithms;deep reinforcement learning;Unmanned Surface Vehicles;complex environments;changeable environments;autonomous navigation ability;perception ability;deep learning","","1","","11","IEEE","14 Mar 2022","","","IEEE","IEEE Conferences"
"Security-Aware Reinforcement Learning under Linear Temporal Logic Specifications","B. Cui; K. Zhu; S. Li; X. Yin","Department of Automation, Shanghai Jiao Tong University, Shanghai, China; Department of Automation, Shanghai Jiao Tong University, Shanghai, China; Department of Automation, Shanghai Jiao Tong University, Shanghai, China; Department of Automation, Shanghai Jiao Tong University, Shanghai, China","2023 IEEE International Conference on Robotics and Automation (ICRA)","4 Jul 2023","2023","","","12367","12373","In this paper, we investigate the problem of reinforcement learning under linear temporal logic (LTL) specifications for Markov decision processes (MDPs) with security constraints. We consider an outside passive intruder (observer) that can observe the external output behavior of the system through an output projection. We assume that the secret of the system is a subset of the initial states. The security constraint requires that the observer can never infer for sure that the agent was initiated from a secret state. Our objective is to learn a control policy that achieves the LTL task while ensuring security. To solve the problem of shaping the reward for reinforcement learning, we propose an approach based on the initial-state estimator and the limit deterministic Büchi automata. We illustrate the proposed approach by a case study of mobile robot example.","","979-8-3503-2365-8","10.1109/ICRA48891.2023.10160753","National Natural Science Foundation of China(grant numbers:62061136004,62173226,61803259); National Key Research and Development Program of China(grant numbers:2018AAA0101700); ","https://ieeexplore.ieee.org/stamp/stamp.jsp?arnumber=10160753","","Automation;Learning automata;Reinforcement learning;Observers;Markov processes;Behavioral sciences;Security","automata theory;learning (artificial intelligence);Markov processes;mobile robots;reinforcement learning;state estimation;temporal logic","external output behavior;initial states;initial-state estimator;linear temporal logic specifications;LTL task;Markov decision processes;observer;output projection;passive intruder;secret state;security constraint;security-aware reinforcement learning","","1","","26","IEEE","4 Jul 2023","","","IEEE","IEEE Conferences"
"HR-Planner: A Hierarchical Highway Tactical Planner based on Residual Reinforcement Learning","H. Wu; Y. Li; H. Zhuang; C. Wang; M. Yang","Department of Automation, Shanghai Jiao Tong University, Shanghai; Department of Automation, Shanghai Jiao Tong University, Shanghai; University of Michigan-Shanghai Jiao Tong University Joint Institute, Shanghai Jiao Tong University, Shanghai, China; Department of Automation, Shanghai Jiao Tong University, Shanghai; Department of Automation, Shanghai Jiao Tong University, Shanghai","2022 International Conference on Robotics and Automation (ICRA)","12 Jul 2022","2022","","","7263","7269","Tactical planning is crucial for safe and efficient driving on the highway. However, the problem is complicated by the uncertain intention of surrounding vehicles, as well as observation noise caused by measurement noise and perception errors. Rule-based tactical planning methods are ineffective in handling dynamic scenarios with uncertainty, and susceptible to observation noise. To tackle this problem, we propose a hierarchical tactical planning framework based on residual reinforcement learning. Besides, a new reinforcement learning from demonstrations scheme that views rule-based methods as soft guidance is developed to combine prior knowledge with data-driven methods. Based on the framework and the training scheme, rule-based methods not only can be improved in highway scenarios with uncertainty and observation noise, but also will guide the training procedure for increased sampling efficiency. Additionally, to boost in-depth and consistent exploration in a vehicle system with inertia, we employ noisy networks to explore the optimal policy. The proposed method is validated in a stochastic and uncertain simulation environment, and the results reveal that our method outperforms both rule-based methods and pure data-driven methods in terms of safety and driving efficiency under noisy observations and uncertainty.","","978-1-7281-9681-7","10.1109/ICRA46639.2022.9812400","","https://ieeexplore.ieee.org/stamp/stamp.jsp?arnumber=9812400","","Road transportation;Training;Uncertainty;Automation;Measurement uncertainty;Reinforcement learning;Planning","learning (artificial intelligence);optimisation;planning (artificial intelligence);stochastic processes","rule-based methods;highway scenarios;observation noise;pure data-driven methods;hierarchical highway tactical planner;residual reinforcement learning;safe driving;efficient driving;measurement noise;perception errors;rule-based tactical planning methods;hierarchical tactical planning framework","","","","34","IEEE","12 Jul 2022","","","IEEE","IEEE Conferences"
"Deep Reinforcement Learning with Sparse Regularized Pruning and Compressing","W. Su; Z. Li; Z. Yang; J. Lu","Department of Automation, Guangdong University of Technology, Guangzhou, China; Department of Automation, Guangdong University of Technology, Guangzhou, China; Department of Automation, Guangdong University of Technology, Guangzhou, China; Department of Automation, Guangdong University of Technology, Guangzhou, China","2021 China Automation Congress (CAC)","14 Mar 2022","2021","","","8041","8046","Deep Reinforcement Learning (DRL) currently demonstrates distinguished performance in various fields of sequential decision tasks. Despite the great success, tremendous model size and large redundant parameters have become the major bottleneck on real-time deployments of DRL models. In this paper, we propose a novel model compression framework for DRL models with sparse regularized pruning method and policy shrinking technology, which can realize the superb balance be-tween the high sparsity and compression rate. In our framework, We first obtain the sparse student model by pruning method with the ℓ1-norm. Then, the shrinking technology is proposed to gain the dense student model for further compressing DRL models. Experiments on Cartpole and Lunarlander environment demonstrate that the proposed algorithm for DRL leads to an improvement state-of-the-art in terms of model size, iteration cycles, and parameters reduction.","2688-0938","978-1-6654-2647-3","10.1109/CAC53003.2021.9727767","","https://ieeexplore.ieee.org/stamp/stamp.jsp?arnumber=9727767","Deep Reinforcement Learning (DRL);sparse regularized pruning;policy shrinking","Automation;Reinforcement learning;Color;Market research;Real-time systems;Sparse matrices;Task analysis","deep learning (artificial intelligence);gradient methods;image coding;optimisation;reinforcement learning","deep reinforcement learning;sequential decision tasks;redundant parameters;real-time deployments;model compression framework;sparse regularized pruning method;policy shrinking technology;compression rate;sparse student model;dense student model;compressing DRL models;sparse regularized compressing;ℓ1-norm;Cartpole and Lunarlander environment;Cartpole and Lunarlander environment","","","","18","IEEE","14 Mar 2022","","","IEEE","IEEE Conferences"
"Multitask reinforcement learning on the distribution of MDPs","F. Tanaka; M. Yamamura","Department of Computational Intelligence and Systems Science, Tokyo Institute of Technology, Japan; Department of Computational Intelligence and Systems Science, Tokyo Institute of Technology, Japan","Proceedings 2003 IEEE International Symposium on Computational Intelligence in Robotics and Automation. Computational Intelligence in Robotics and Automation for the New Millennium (Cat. No.03EX694)","18 Aug 2003","2003","3","","1108","1113 vol.3","In this paper we address a new problem in reinforcement learning. Here we consider an agent that faces multiple learning tasks within its lifetime. The agent's objective is to maximize its total reward in the lifetime as well as a conventional return in each task. To realize this, it has to be endowed an important ability to keep its past learning experiences and utilize them for improving future learning performance. This time we try to phrase this problem formally. The central idea is to introduce an environmental class, BV-MDPs that is defined with the distribution of MDPs. As an approach to exploiting past learning experiences, we focus on statistics (mean and deviation) about the agent's value tables. The mean can be used as initial values of the table when a new task is presented. The deviation can be viewed as measuring reliability of the mean, and we utilize it in calculating priority of simulated backups. We conduct experiments in computer simulation to evaluate the effectiveness.","","0-7803-7866-0","10.1109/CIRA.2003.1222152","","https://ieeexplore.ieee.org/stamp/stamp.jsp?arnumber=1222152","","Learning;Robots;Computational intelligence;Computer simulation;Cleaning;Computational modeling;Computer errors;Dogs;Cats;Uncertainty","learning (artificial intelligence);decision theory;Markov processes","multitask reinforcement learning;Markov decision processes;multiple learning tasks;past learning experiences;reliability measurement","","23","","11","IEEE","18 Aug 2003","","","IEEE","IEEE Conferences"
"A parameter control method inspired from neuromodulators in reinforcement learning","K. Murakoshi; J. Mizuno","Department of Knowledge-based Information Engineering, Toyohashi University of Technology, Japan; Department of Knowledge-based Information Engineering, Toyohashi University of Technology, Japan","Proceedings 2003 IEEE International Symposium on Computational Intelligence in Robotics and Automation. Computational Intelligence in Robotics and Automation for the New Millennium (Cat. No.03EX694)","18 Aug 2003","2003","1","","7","12 vol.1","The brain gains appropriate behaviors, which get rewards and escapes punishments by trial-and-error. Reinforcement learning models such a system by an engineering approach. Neuromodulators, which project widely in the brain and adjust functions in each brain part, are matched with parameters of reinforcement learning. We propose a reinforcement learning algorithm, which can follow sudden changes in environment by considering how neuromodulators affect behaviors. This algorithm improves actions by controlling the parameters of reinforcement learning after the obtained reward decreased as compared with the past. Computer simulation shows that the robots with the proposed algorithm are able to respond flexibly to sudden environmental changes.","","0-7803-7866-0","10.1109/CIRA.2003.1222054","","https://ieeexplore.ieee.org/stamp/stamp.jsp?arnumber=1222054","","Learning;Knowledge engineering;Appropriate technology;Systems engineering and theory;Computer simulation;Robot control;Neurons;Circuits;Humans;Animals","neural nets;learning (artificial intelligence);mobile robots","parameter control method;neuromodulators;reinforcement learning;sudden environmental changes;robots","","","","9","IEEE","18 Aug 2003","","","IEEE","IEEE Conferences"
"Reinforcement Learning of a Robot Cell Control Logic using a Software-in-the-Loop Simulation as Environment","F. Jaensch; A. Csiszar; J. Sarbandi; A. Verl","Institute of Control Engineering of Machine Tools and Manufacturing Units, University of Stuttgart, Stuttgart, Germany; Institute of Control Engineering of Machine Tools and Manufacturing Units, University of Stuttgart, Stuttgart, Germany; Institute of Control Engineering of Machine Tools and Manufacturing Units, University of Stuttgart, Stuttgart, Germany; Institute of Control Engineering of Machine Tools and Manufacturing Units, University of Stuttgart, Stuttgart, Germany","2019 Second International Conference on Artificial Intelligence for Industries (AI4I)","9 Mar 2020","2019","","","79","84","This paper introduces a method for automatic robot programming of industrial robots using reinforcement learning on a Software-in-the-loop simulation. The focus of the the paper is on the higher levels of a hierarchical robot programming problem. While the lower levels the skills are stored as domain specific program code, the combination of the skills into a robot control program to solve a specific task is automated. The reinforcement learning learning approach allows the shopfloor workers and technicians just to define the end result of the manufacturing process through a reward function. The programming and process optimization is done within the learning procedure. The Software-in-the-loop simulation with the robot control software makes it possible to to interpret the real program code and generate the exact motion. The exact motion of the robot is needed in order to find not just an optimal but also a collision-free policy.","","978-1-7281-4087-2","10.1109/AI4I46381.2019.00027","","https://ieeexplore.ieee.org/stamp/stamp.jsp?arnumber=9027783","Reinforcement Learning;Robot Control;Software in the Loop Simulation","Optimization;Learning (artificial intelligence);Service robots;Robot control;Software","control engineering computing;industrial robots;learning (artificial intelligence);mobile robots;robot programming","robot cell control logic;Software-in-the-loop simulation;automatic robot programming;industrial robots;hierarchical robot programming problem;domain specific program code;robot control program;reinforcement learning learning approach;process optimization;robot control software","","5","","15","IEEE","9 Mar 2020","","","IEEE","IEEE Conferences"
