"Optimized Reward Function Based Deep Reinforcement Learning Approach for Object Detection Applications","Z. Tan; M. Karaköse","Erzincan Binali Yıldırım University, Erzincan, Turkey; Computer Engineering Department, Firat University, Elazig, Turkey","2022 International Conference on Decision Aid Sciences and Applications (DASA)","2 May 2022","2022","","","1367","1370","Reinforcement learning is considered a powerful artificial intelligence method that can be used to teach machines through interaction with the environment and learning from their mistakes. More and more applications are coming to the fore where Reinforcement learning has been newly and successfully implemented. It is frequently used especially in the game industry and robotics. In this article, a deep reinforcement learning approach, which uses our own developed neural network, is presented for object detection on the PASCAL Voc2012 dataset. Our approach is by moving a bounding box step-by-step towards the goal in order to fully frame the object in the picture. The created neural network consists of a 5-layer structure. In addition, it is aimed to maximize the mAP value by optimizing the reward function. The right choice in the reward policy will certainly affect the outcome and will play an important role in the training of the agent. Thanks to the optimized reward function, ground truth and the bounding box intersect at the highest rate, contributing positively to the result. As a result of the training that lasted for approximately 36 hours, the test results of 6 randomly selected classes were compared with the results of previous similar studies. Within the scope of this article, some artificial neural networks and basic studies in the literature using the Reinforcement learning approach for object detection are examined.","","978-1-6654-9501-1","10.1109/DASA54658.2022.9764979","","https://ieeexplore.ieee.org/stamp/stamp.jsp?arnumber=9764979","Object detection;deep reinforcement learning;CNN;deep learning","Training;Industries;Deep learning;Service robots;Reinforcement learning;Object detection;Learning (artificial intelligence)","deep learning (artificial intelligence);image representation;neural nets;object detection","optimized reward function;object detection applications;artificial intelligence method;game industry;robotics;deep reinforcement learning approach;developed neural network;PASCAL Voc2012 dataset;reward policy;bounding box intersect;artificial neural networks;time 36.0 hour","","","","22","IEEE","2 May 2022","","","IEEE","IEEE Conferences"
"Reinforcement Learning-Driven Continuous and Crashless Load Test Architecture","T. Büyüktanır; B. Erbay; M. Altun","Loodos Tech, İstanbul; Bilgisayar Mühendisligĭ Bölümü, Yıldız Teknik Üniversitesi, İstanbul; Bilişim Teknolojileri Bölümü, Sabancı Üniversitesi, İstanbul","2022 30th Signal Processing and Communications Applications Conference (SIU)","29 Aug 2022","2022","","","1","4","Realistic load testing of software systems and continuous testing of the systems is an industry requirement. Within the scope of this study, a software architecture was presented, and prototype implementation was implemented for load testing of live systems with realistic loads continuously and without crashing the system. Experiments of the crashless load test module of the prototype were implemented, and successful results were obtained from experiments.","2165-0608","978-1-6654-5092-8","10.1109/SIU55565.2022.9864834","","https://ieeexplore.ieee.org/stamp/stamp.jsp?arnumber=9864834","reinforcement learning;load test;crashless load test;continuous load test","Industries;Software architecture;Prototypes;Computer architecture;Signal processing;Software systems;Computer crashes","program testing;reinforcement learning;software architecture","reinforcement learning-driven continuous;crashless load test architecture;realistic load testing;software systems;continuous testing;industry requirement;software architecture;live systems;crashless load test module","","","","0","IEEE","29 Aug 2022","","","IEEE","IEEE Conferences"
"Multi-component Maintenance Optimization: an Approach combining Genetic Algorithm and Multiagent Reinforcement Learning","B. Li; Y. Zhou","Dept. School of Mechanical Engineering, Southeast University, Nanjing, China; Dept. School of Mechanical Engineering, Southeast University, Nanjing, China","2020 Global Reliability and Prognostics and Health Management (PHM-Shanghai)","18 Dec 2020","2020","","","1","7","The maintenance strategy optimization of the systems with intermediate buffers is a typical maintenance optimization. As the number of components in the system is increased, the state space and action space of the maintenance optimization of the manufacturing system with buffer inventory increase exponentially. Multi-agent reinforcement learning is an effective method to optimize the maintenance decision making of large multi-component system. However, as the number of agents increases, the reward function of multi-agent reinforcement learning tends to be complicated, and each agent will receive a noisy reward signal, so it is difficult for multi-agent reinforcement learning to converge to the optimal strategy. Considering the excellent global optimization ability of genetic algorithm, this paper adopts genetic algorithm as the central unit to guide the decision-making of each agent, and establishes a bilateral interaction mechanism between multi-agent reinforcement learning and genetic algorithm, through which both genetic algorithm and multi-agent reinforcement learning can learn the solutions provided by the other party. Numerical research results show that the proposed method is superior to multi-agent reinforcement learning and genetic algorithm in terms of solution quality.","","978-1-7281-5946-1","10.1109/PHM-Shanghai49105.2020.9280997","National Natural Science Foundation of China(grant numbers:71671041); ","https://ieeexplore.ieee.org/stamp/stamp.jsp?arnumber=9280997","maintenance optimization;genetic algorithm;multiagent reinforcement learning;intermediate buffert","Decision making;Reinforcement learning;Maintenance engineering;Reliability;Optimization;Genetic algorithms;Manufacturing systems","decision making;genetic algorithms;learning (artificial intelligence);maintenance engineering;manufacturing systems;multi-agent systems;production engineering computing","genetic algorithm;multicomponent maintenance optimization;maintenance strategy optimization;multiagent reinforcement learning;multicomponent system;manufacturing system;bilateral interaction mechanism;decision-making;buffer inventory","","2","","20","IEEE","18 Dec 2020","","","IEEE","IEEE Conferences"
"Large-Scale Traffic Signal Control Using a Novel Multiagent Reinforcement Learning","X. Wang; L. Ke; Z. Qiao; X. Chai","State Key Laboratory for Manufacturing Systems Engineering, School of Automation Science and Engineering, Xi’an Jiaotong University, Xi’an, China; State Key Laboratory for Manufacturing Systems Engineering, School of Automation Science and Engineering, Xi’an Jiaotong University, Xi’an, China; State Key Laboratory for Manufacturing Systems Engineering, School of Automation Science and Engineering, Xi’an Jiaotong University, Xi’an, China; CETC Key Laboratory of Aerospace Information Applications, Shijiazhuang, China","IEEE Transactions on Cybernetics","22 Dec 2020","2021","51","1","174","187","Finding the optimal signal timing strategy is a difficult task for the problem of large-scale traffic signal control (TSC). Multiagent reinforcement learning (MARL) is a promising method to solve this problem. However, there is still room for improvement in extending to large-scale problems and modeling the behaviors of other agents for each individual agent. In this article, a new MARL, called cooperative double Q-learning (Co-DQL), is proposed, which has several prominent features. It uses a highly scalable independent double Q-learning method based on double estimators and the upper confidence bound (UCB) policy, which can eliminate the over-estimation problem existing in traditional independent Q-learning while ensuring exploration. It uses mean-field approximation to model the interaction among agents, thereby making agents learn a better cooperative strategy. In order to improve the stability and robustness of the learning process, we introduce a new reward allocation mechanism and a local state sharing method. In addition, we analyze the convergence properties of the proposed algorithm. Co-DQL is applied to TSC and tested on various traffic flow scenarios of TSC simulators. The results show that Co-DQL outperforms the state-of-the-art decentralized MARL algorithms in terms of multiple traffic metrics.","2168-2275","","10.1109/TCYB.2020.3015811","National Natural Science Foundation of China(grant numbers:61973244,61573277); ","https://ieeexplore.ieee.org/stamp/stamp.jsp?arnumber=9186324","Double estimators;mean-field approximation;multiagent reinforcement learning (MARL);traffic signal control (TSC)","Learning (artificial intelligence);Convergence;Games;Nash equilibrium;Standards;Markov processes","learning (artificial intelligence);multi-agent systems;optimisation;road traffic control","large-scale traffic signal control;multiagent reinforcement learning;optimal signal timing strategy;large-scale problems;individual agent;highly scalable independent double Q-learning method;double estimators;over-estimation problem;independent Q-learning;learning process;local state sharing method;traffic flow scenarios;decentralized MARL algorithms;multiple traffic metrics;cooperative double Q-learning;upper confidence bound policy;UCB;mean-field approximation;reward allocation mechanism;convergence properties;Co-DQL;TSC simulators","","62","","49","IEEE","3 Sep 2020","","","IEEE","IEEE Journals"
"Reinforcement Learning Tracking Control for Robotic Manipulator With Kernel-Based Dynamic Model","Y. Hu; W. Wang; H. Liu; L. Liu","State Key Laboratory of Robotics, Shenyang Institute of Automation, Chinese Academy of Sciences, Shenyang, China; State Key Laboratory of Robotics, Shenyang Institute of Automation, Chinese Academy of Sciences, Shenyang, China; Department of Mathematics, Georgia Institute of Technology, Atlanta, USA; State Key Laboratory of Robotics, Shenyang Institute of Automation, Chinese Academy of Sciences, Shenyang, China","IEEE Transactions on Neural Networks and Learning Systems","1 Sep 2020","2020","31","9","3570","3578","Reinforcement learning (RL) is an efficient learning approach to solving control problems for a robot by interacting with the environment to acquire the optimal control policy. However, there are many challenges for RL to execute continuous control tasks. In this article, without the need to know and learn the dynamic model of a robotic manipulator, a kernel-based dynamic model for RL is proposed. In addition, a new tuple is formed through kernel function sampling to describe a robotic RL control problem. In this algorithm, a reward function is defined according to the features of tracking control in order to speed up the learning process, and then an RL tracking controller with a kernel-based transition dynamic model is proposed. Finally, a critic system is presented to evaluate the policy whether it is good or bad to the RL control tasks. The simulation results illustrate that the proposed method can fulfill the robotic tracking tasks effectively and achieve similar and even better tracking performance with much smaller inputs of force/torque compared with other learning algorithms, demonstrating the effectiveness and efficiency of the proposed RL algorithm.","2162-2388","","10.1109/TNNLS.2019.2945019","National Key R & D Program of China(grant numbers:2016YFE0206200); Key R & D and Technology Transfer Program of Shenyang Science and Technology Plan(grant numbers:18-400-6-16); ","https://ieeexplore.ieee.org/stamp/stamp.jsp?arnumber=8890006","Kernel function;reinforcement learning (RL);reward function;robotics tracking control","Manipulator dynamics;Heuristic algorithms;Task analysis;Kernel;Adaptation models","learning (artificial intelligence);learning systems;manipulator dynamics;optimal control;position control","robotic tracking tasks;learning algorithms;RL algorithm;reinforcement learning tracking control;robotic manipulator;kernel-based dynamic model;optimal control policy;continuous control tasks;kernel function sampling;robotic RL control problem;learning process;RL tracking controller;kernel-based transition dynamic model;RL control tasks","","20","","33","IEEE","1 Nov 2019","","","IEEE","IEEE Journals"
"Stochastic Economic Lot Scheduling via Self-Attention Based Deep Reinforcement Learning","W. Song; N. Mi; Q. Li; J. Zhuang; Z. Cao","Institute of Marine Sci-ence and Technology, Shandong University, Qingdao, China; Institute of Marine Sci-ence and Technology, Shandong University, Qingdao, China; Institute of Marine Sci-ence and Technology, Shandong University, Qingdao, China; Agency for Science Technology and Research (A*STAR), Singapore Institute of Manufacturing Technology (SIMTech), Singapore, Singapore; Agency for Science Technology and Research (A*STAR), Institute for Infocomm Research (I2R), Singapore, Singapore","IEEE Transactions on Automation Science and Engineering","","2023","PP","99","1","12","The Stochastic Economic Lot Scheduling Problem (SELSP) is a difficult dynamic optimization problem with wide industrial applications. Traditional methods such as hyper-heuristics are manually designed based on substantial expert knowledge, which may limit their optimization performance. Recently, Deep Reinforcement Learning (DRL) is shown to be promising in automatically learning scheduling policies for SELSP. However, its performance is still quite far from that of hyper-heuristics, due to the lack of suitable deep models. In this paper, we propose a novel DRL method to learn dynamic scheduling policies for SELSP in an end-to-end fashion. Based on self-attention, our method can effectively extract useful features from raw state information, and is flexible in handling different numbers of products, which is not viable for previous methods. Experiments on a complex biopharmaceutical manufacturing process show that our method outperforms a recent DRL method and state-of-the-art hyper-heuristics. Moreover, the trained policy performs better in environments different from training with demand forecast errors and varying number of products, showing its strong robustness and generalization ability. Note to Practitioners—The Stochastic Economic Lot Scheduling Problem (SELSP) is an important problem for manufacturing enterprises, which is to optimally balance the production and inventory so as to minimize the total cost. However, SELSP is very challenging to solve due to the involvement of uncertain factors such as customer demands and machine failures. Traditional methods for solving SELSP, such as heuristic policies and hyper-heuristics, heavily rely on human experiences to design and hence the performance could be limited. This paper proposes a Deep Reinforcement Learning (DRL) based method to automatically learn scheduling policy for solving SELSP, which could alleviate the above limitation through a self-attention based feature extraction mechanism and reward based training. Experimental results on a realistic manufacturing process show that our method can deliver higher revenue than conventional manual policy and an existing DRL based method.","1558-3783","","10.1109/TASE.2023.3248229","National Natural Science Foundation of China(grant numbers:62102228); Natural Science Foundation of Shandong Province(grant numbers:ZR2021QF063); Young Scholar Future Plan of Shandong University(grant numbers:62420089964188); First A*Star Career Development(grant numbers:202D800040); ","https://ieeexplore.ieee.org/stamp/stamp.jsp?arnumber=10054449","Deep reinforcement learning;stochastic economic lot scheduling;self-attention","Production;Job shop scheduling;Metaheuristics;Costs;Dynamic scheduling;Reinforcement learning;Deep learning","","","","3","","","IEEE","27 Feb 2023","","","IEEE","IEEE Early Access Articles"
"Imitation and Adaptation Based on Consistency: A Quadruped Robot Imitates Animals from Videos Using Deep Reinforcement Learning","Q. Yao; J. Wang; S. Yang; C. Wang; H. Zhang; Q. Zhang; D. Wang","State Key Laboratory of Robotics, Shenyang Institute of Automation, Chinese Academy of Sciences, Shenyang, China; School of Engineering, Westlake University, Hangzhou, China; School of Engineering, Westlake University, Hangzhou, China; State Key Laboratory of Robotics, Shenyang Institute of Automation, Chinese Academy of Sciences, Shenyang, China; School of Engineering, Westlake University, Hangzhou, China; State Key Laboratory of Robotics, Shenyang Institute of Automation, Chinese Academy of Sciences, Shenyang, China; School of Engineering, Westlake University, Hangzhou, China","2022 IEEE International Conference on Robotics and Biomimetics (ROBIO)","18 Jan 2023","2022","","","1414","1419","The essence of quadruped movements is the move-ment of the center of gravity, which has a pattern in the movement of quadrupeds. However, planning the gait motion of the quadruped robot is time consuming. Animals in nature can provide a large amount of gait information for robots to imitate skills. Common methods learn the posture of animals with a motion capture system or numerous motion data points. In this paper, we propose a video imitation adaptation network that can imitate the action of animals from a few seconds of video and adapt skills to the robot. The deep learning model extracts key points of animal motion from videos. A motion adaptor that eliminates noise and extracts key information of motion is proposed; the information of the extracted movements was used as a motion pattern to help deep reinforcement learning complete the imitation of skills. To ensure similarity between the learning result and the animal motion in the video, we introduce rewards that are based on the consistency of the motion. The results show that our framework can help robots learn periodic and aperiodic skills from several seconds of videos of different types of animals. And we deploy the trained model to the real robot to complete the walking and backflip tasks without fine-tuning.","","978-1-6654-8109-0","10.1109/ROBIO55434.2022.10011737","NSFC(grant numbers:62176215); ","https://ieeexplore.ieee.org/stamp/stamp.jsp?arnumber=10011737","","Deep learning;Legged locomotion;Adaptation models;Animals;Reinforcement learning;Motion capture;Planning","computer animation;gait analysis;learning (artificial intelligence);legged locomotion;motion control","animal motion;aperiodic skills;complete the imitation;deep learning model extracts key points;deep reinforcement learning;extracted movements;extracts key information;gait information;gait motion;imitate skills;learning result;motion adaptor;motion capture system;motion pattern;numerous motion data points;periodic skills;quadruped movements;quadruped robot imitates animals;video imitation adaptation network","","2","","27","IEEE","18 Jan 2023","","","IEEE","IEEE Conferences"
"Robotic Tracking Control with Kernel Trick-based Reinforcement Learning","Y. Hu; W. Wang; H. Liu; L. Liu","State Key Laboratory of Robotics, Shenyang Institute of Automation, Institutes for Robotics and Intelligent Manufacturing, Chinese Academy of Sciences, Shenyang, China; State Key Laboratory of Robotics, Shenyang Institute of Automation, Institutes for Robotics and Intelligent Manufacturing, Chinese Academy of Sciences, Shenyang, China; department of mathematics, Georgia Institute of Technology, Atlanta, GA, USA; State Key Laboratory of Robotics, Shenyang Institute of Automation, Institutes for Robotics and Intelligent Manufacturing, Chinese Academy of Sciences, Shenyang, China","2019 IEEE/RSJ International Conference on Intelligent Robots and Systems (IROS)","28 Jan 2020","2019","","","997","1002","In recent years, reinforcement learning has been developed dramatically and is widely used to solve control problems, e.g., playing games. However, there are still some problems for reinforcement learning to perform robotic control tasks. Fortunately, the kernel trick-based methods provide a chance to deal with those challenges. This work aims at developing a kernel trick-based learning control method to carry out robotic tracking control tasks. A reward system, in this work, is presented in order to speed up the learning processes. And then, a kernel trick-based reinforcement learning tracking controller is presented to perform tracking control tasks on a robotic manipulator system. To evaluate the policy and assist the reward system to accelerate the speed of finding the optimal control policy, a critic system is introduced. Finally, from the comparison with the benchmark, the simulation results illustrate that our algorithm has faster convergence rate and can execute tracking control tasks effectively, the reward function and the critic system proposed in this work is efficient.","2153-0866","978-1-7281-4004-9","10.1109/IROS40897.2019.8968574","","https://ieeexplore.ieee.org/stamp/stamp.jsp?arnumber=8968574","","","learning (artificial intelligence);learning systems;manipulators;optimal control;robot programming","robotic tracking control tasks;reward system;robotic manipulator system;optimal control;critic system;kernel trick-based reinforcement learning tracking controller;machine learning","","1","","31","IEEE","28 Jan 2020","","","IEEE","IEEE Conferences"
"(Re)2H2O: Autonomous Driving Scenario Generation via Reversely Regularized Hybrid Offline-and-Online Reinforcement Learning","H. Niu; K. Ren; Y. Xu; Z. Yang; Y. Lin; Y. Zhang; J. Hu","Department of Automation, Tsinghua University, Beijing, China; Department of Automation, Tsinghua University, Beijing, China; Department of Automation, Tsinghua University, Beijing, China; Department of Automation, Tsinghua University, Beijing, China; Department of Automation, Tsinghua University, Beijing, China; Department of Automation, Tsinghua University, Beijing, China; Department of Automation, Tsinghua University, Beijing, China","2023 IEEE Intelligent Vehicles Symposium (IV)","27 Jul 2023","2023","","","1","8","Autonomous driving and its widespread adoption have long held tremendous promise. Nevertheless, without a trustworthy and thorough testing procedure, not only does the industry struggle to mass-produce autonomous vehicles (AV), but neither the general public nor policymakers are convinced to accept the innovations. Generating safety-critical scenarios that present significant challenges to AV is an essential first step in testing. Real-world datasets include naturalistic but overly safe driving behaviors, whereas simulation would allow for unrestricted exploration of diverse and aggressive traffic scenarios. Conversely, higher-dimensional searching space in simulation disables efficient scenario generation without real-world data distribution as implicit constraints. In order to marry the benefits of both, it seems appealing to learn to generate scenarios from both offline real-world and online simulation data simultaneously. Therefore, we tailor a Reversely Regularized Hybrid Offline-and-Online ((Re)2H2O) Reinforcement Learning recipe to additionally penalize Q-values on real-world data and reward Q-values on simulated data, which ensures the generated scenarios are both varied and adversarial. Through extensive experiments, our solution proves to produce more risky scenarios than competitive baselines and it can generalize to work with various autonomous driving models. In addition, these generated scenarios are also corroborated to be capable of fine-tuning AV performance.","2642-7214","979-8-3503-4691-6","10.1109/IV55152.2023.10186559","National Natural Science Foundation of China; ","https://ieeexplore.ieee.org/stamp/stamp.jsp?arnumber=10186559","","Industries;Technological innovation;Reinforcement learning;Hybrid power systems;Behavioral sciences;Autonomous vehicles;Testing","mobile robots;reinforcement learning;road vehicles","aggressive traffic scenarios;autonomous driving scenario generation;AV;driving behaviors;H2O;higher-dimensional searching space;mass-produce autonomous vehicles;offline real-world;online simulation data;policymakers;Q-values;real-world data distribution;reversely regularized hybrid offline-and-online reinforcement learning;risky scenarios;safety-critical scenarios","","","","58","IEEE","27 Jul 2023","","","IEEE","IEEE Conferences"
